titles,category
이복현 금감원장  김건희 여사 주가조작 의혹  증거 없어 기소 못 했다 ,Securities
뿔난 남양유업 소액주주들  대법원 무시하는 홍 회장  주주 배려해야 ,Securities
  증권    일까지  년 만기     공모,Securities
국민연금  지난해   월까지 잠정수익률       기록,Securities
프리엠스  주당   원 결산배당 결정,Securities
국민연금 수익률 두 자릿수 눈 앞   월 기금 자산     조,Securities
 특징주 삼성바이오로직스    대 강세     중국기업 규제 영향 ,Securities
벤치마크 못 따라가는    자산운용 투자자 이탈  가속 ,Securities
앱클론  작년 영업손실    억 전년        ,Securities
대상  지난해 영업이익     억 전년        ,Securities
대한제강  지난해 영업이익     억 전년        ,Securities
삼성전자 갤럭시에 바이두    장착    침투 효과적일 것,Securities
남양유업 소액주주모임  사명 바꿔달라 차파트너스 공개매수 제안은 거절 ,Securities
티에스이         개발  세미콘 코리아      공개 ,Securities
명품 플랫폼 발란  작년  분기 영업이익 첫 흑자 창립  년만 ,Securities
 주가 바겐세일 끝날라  외국인 매집에     ,Securities
한 달 만에  조 이탈  초비상  개미들 자금 이곳으로 몰렸다,Securities
프리엠스  주당   원 현금배당,Securities
대신증권  연   대 우량 채권 온라인 특판,Securities
프리엠스  작년 영업손실     만원 적자 전환,Securities
 속보 김주현  홍콩      책임질 것 있으면 책임질 것 ,Securities
교보증권  연계영업 강화를 위한   비즈센터 현판식 개최,Securities
    열풍  타고 올해 주가  배 뛴 한글과컴퓨터     대 급락 핫종목 ,Securities
 속보 김주현  은행     판매 금지  검사 결과 볼 것 ,Securities
강희수 요기요 본부장  타다 운전대 잡고  부르릉 ,Securities
   라씨로  태영건설우  공사대금 이슈 해소에 주가  ,Securities
한국   협력업체들  남선알미늄 본사 방문,Securities
  그룹  비상경영체제속 공격적 투자 눈길  거래 재개에 사활 ,Securities
한국증권금융  이영찬 신임 상무 선임,Securities
  바이오팜  분기 영업익 흑자전환   올해 흑자기조 목표 ,Securities
경보제약  지난해 영업익   억 전년비         ,Securities
이복현  김건희 주가조작 의혹  증거 있었으면 기소했을 것 ,Securities
  갤럭시         구글 대신 바이두  어니봇  탑재,Securities
   라씨로  선광  작년 호실적에 주가     ,Securities
금감원  가상자산 불공정거래도 신고받는다,Securities
하이투자증권   하이 마이트리     랩  판매,Securities
기업거버넌스포럼  증시 저평가 해소책 내놓는다,Securities
     인도 뭄바이 사무소 설립,Securities
대기자금 반등에 비트코인도 반등  매일코인 ,Securities
대한제강  지난해 영업익     억 전년비        ,Securities
  바이오팜 작년 영업손실    억원 적자 축소 종합 보 ,Securities
농구단까지 샀던 회사의 기막힌 몰락 자본시장서 퇴출당했다,Securities
 만원 돌파한     신약     승인 기대감이 견인,Securities
실적 전망 먹구름    셈법 복잡해진 에코프로비엠    베팅    들,Securities
삼화페인트  지난해 영업이익    억 전년        ,Securities
     다음달  일 기업설명회 개최,Securities
트루엔  지난해 영업이익    억 전년         ,Securities
바이오다인  지난해 영업손실   억 적자 전환,Securities
롯데정보통신  작년 영업익    억 전년비         주목  공시 ,Securities
커머스마이너  지난해 영업이익  억 전년        ,Securities
탑코미디어  웹툰    기반  숏폼 드라마  제작,Securities
삼화페인트  지난해 영업익    억 전년비        ,Securities
 동양사태  피해자들  천억원대 집단소송 항소심도 패소,Securities
오가닉티코스메틱   월  일 주주총회 소집,Securities
케이리츠    농협캐피탈빌딩 매각 속도 주관사에      선정,Securities
금감원  가상자산 신고센터 확대개편 시세조종 등 불공정거래도 접수  투자    ,Securities
키움증권  미국주식옵션 기초자산    종목으로 확대,Securities
트루엔  지난해 영업익    억 전년비        ,Securities
 특징주  이마트  스타필드 의무휴업 폐지 기대감 업고  급등 ,Securities
부동산   충당금 압박에 증권사    적자 불가피 믿을건 전통  ,Securities
 단독  더현대 서울   명품 시계 주얼리  까르띠에 품는다,Securities
 특징주 삼성전자       램  연구개발 소식에 기술적 반등까지   대 ,Securities
 속보 이복현  내달 홍콩     은행 증권사 검사 끝낼 것 ,Securities
헝다 청산에도 중화권증시 일제 상승  항셍       상하이      ,Securities
  중공업     억 규모 재건축사업 시공사 선정,Securities
 증시신상품    증권  홍콩 지수 기초자산 원금지급형     공모,Securities
신한   금융   인재 양성  프로 디지털 아카데미   기 교육생 모집,Securities
금융    기업 밸류업  도입 임박에      배 기대감 ,Securities
탑코미디어  웹툰    기반  숏폼 드라마  제작,Securities
     다음달  일 기업설명회 개최,Securities
트루엔  작년 영업익    억 전년        ,Securities
남선알미늄  한국    협신회  벤치마킹 행사로 본사 방문 ,Securities
  증권    시간 실시간 환전 거래 서비스 제공,Securities
  헝다 청산 명령에도 중화권 증시 되레 올라  권영훈의 증시뉴스      ,Securities
바이오다인  작년 영업손실   억    만원 적자 전환,Securities
유진투자선물  해외선물 실전투자대회  커뮤니티 리그 시즌    개최,Securities
코스피  외국인 기관 쌍끌이 매수에 기술적 반등     선,Securities
  바이오팜  작년 영업손실    억 전년비 적자 축소  주목  공시 ,Securities
스튜디오삼익  청약 증거금    넘었다 경쟁률     대   기록,Securities
이복현 원장  도이치모터스건 증거 있었으면 기소했을 것 ,Securities
      전환사채 채권자와 채무조정 합의,Securities
 돈 안 갚으면 압류  추심업자의 협박    판결 공증 없으면  무효 ,Securities
우리자산운용  순자산   조원 규모 운용사로 새출발 통합법인 출범,Securities
남선알미늄  한국    협신회  벤치마킹 행사로 본사 방문 ,Securities
제이엘스탠다드             메타버스 글로벌마켓  공동관 참가 지원사업  선정,Securities
탑코미디어  웹툰   기반  숏폼 드라마  제작,Securities
비사이드  가치투자분석 공모전 진행,Securities
지난해     발행금액   조   억원 전년       ,Securities
커머스마이너  작년 영업이익  억 전년        ,Securities
   조원 규모   년물 입찰 소화    년물 금리         채권분석 ,Securities
 솔로지옥   천국도 그곳  스타셰프가 밸런타인 프로모션,Securities
메디아나  지난해 매출    억원  역대 최대치 재경신 ,Securities
 특징주 부방 계열사  그린수소 대량생산 핵심기술 이전 상용화 추진 소식에 ,Securities
신개념 해양도시 개발로 시화    주목   힐스테이트 라군인테라스 차  분양,Securities
 신규 조성 기금 운용 역량 강화 필수  정책금융기관 새해 분주히 조직재편,Securities
   라씨로 엘앤에프  코스피 이전 상장 첫날 하락세,Securities
행동주의 펀드  주총시즌 앞두고 활동 본격화 단기이익 치중 우려도,Securities
해외는  골디락스    코스피만   월 악몽  왜,Securities
탑코미디어  웹툰    기반  숏폼 드라마  제작  글로벌 플랫폼 방영 목표 ,Securities
올릭스    일 기업설명회 개최,Securities
금감원  가상자산 불공정거래도 신고받는다,Securities
롯데정보통신  지난해 영업이익    억 전년        ,Securities
 특징주  태영건설  공사대금 이슈 해소에  쑥  우선주는 상한가,Securities
코텍  전환가액     원으로 하향 조정,Securities
 공시   바이오팜      년    억 영업손실,Securities
금감원  가상자산 투자사기 기승  신고센터 개편 엄정 대응 ,Securities
 재 서울테크노파크  스마트공장 구축 지원 위한 퍼실리테이터 사업 참여기업 모집,Securities
코스닥  기관 외국인  팔자     그룹주 급등,Securities
홍콩법원  부채    조원 헝다 청산 명령  법원 승인 관건,Securities
 동양그룹 사태  피해자들      억원대 집단소송  심서도 패소,Securities
  증권   홍콩 지수      공모  최고      수익률 ,Securities
   오후시황 코스피  동학개미 순매도에도     선 상승세,Securities
 충남 천안 그린스타트업타운 오픈이노베이션 성료 ,Securities
서울시 중부 남부기술교육원 남부캠퍼스      년 상반기 무료 교육생 모집,Securities
 찐비트 기업들의 월동대책에  방학 을 포함하라,Securities
 다시   만원 찍었다  최고가는 시간문제  삼바  주가도  축포  쏠까,Securities
  바이오팜 작년 영업손실    억원 적자 축소 종합 ,Securities
 특징주  와이씨켐  삼성  유리 반도체 기판  가속화  세계 최초 유리 코팅제 개발 부각,Securities
 평생 주택 소유는 불가능     세대    의 답변,Securities
키움증권  미국주식옵션 기초자산    종목으로 확대 ,Securities
교보증권  연계영업 강화 위한      센터 현판식,Securities
달러 강세 외국인 순매수 전환 장중 환율      원 중후반대 레인지 외환분석 ,Securities
 주간뉴욕증시       고용지표 빅테크 실적 등 주목,Securities
 속보 김주현  홍콩     피해자 배상  충분히 감안할 것 ,Securities
글로벌텍스프리   년만에 흑자 청신호 올해도 성장 이어갈까,Securities
롯데정보통신    일 기업설명회 개최,Securities
이복현  금소법  년      계기로 점검할 필요 ,Securities
롯데정보통신  지난해  분기 영업이익    억 전년        ,Securities
마니커에프앤지  지난해 영업이익   억 흑자 전환,Securities
헝다 파산에도 항셍지수    상승  시장 영향 거의 없어,Securities
가상자산 불법행위 통합 신고센터 구축,Securities
 가상자산 투자사기  신고  평균    건 금감원  엄정 대응 ,Securities
회삿돈   억 빼돌려 가족 외제차 리스비용 낸 대부업 대표,Securities
금감원  가상자산 불공정거래도 신고받는다 센터 개편,Securities
금감원  가상자산 불공정거래 의심 건도 제보받는다,Securities
금감원  가상자산신고센터 개편  불공정거래신고도 접수,Securities
 미  세계 최고 회복세 의회 필두로 정부 연준 대응 주효 ,Securities
 증거금 무려  조원  스튜디오삼익  내달  일 코스닥 상장,Securities
한투운용  엔터주 집중투자     출시  대 종목 비중    ,Securities
     올해 회복된다 증시 상승에 투자금 회수 늘 것 ,Securities
이복현  홍콩     고강도 조사 제도개선 검토 ,Securities
이복현  김건희 주가조작 연루 의혹  증거 없어 기소 못했다 ,Securities
 바닥 찍고 반등  에코프로머티 순매수  위 주식 초고수는 지금 ,Securities
중국  공매도 제한  주가 부양책에도 증시 하락세      오전 ,Securities
율촌  전자투표제 도입,Securities
        다음달   일 주주총회 소집,Securities
크리에이츠           쇼 성황 속 마무리     신제품 공개,Securities
마니커프에프앤지  작년 영업이익   억 흑자 전환,Securities
엠브레인  데이터 테크 기업으로 도약하다,Securities
 미지급 공사대금 전달  사업장 정상화 기대감에 태영건설우     핫종목 ,Securities
 올해     시장 회복세 불확실성 지속돼 상장전략 다변화해야 ,Securities
하이투자증권   하이 마이트리     랩  판매,Securities
신한투자증권  금융    인재 양성 프로그램  기 교육생 모집,Securities
    년     발행금액   조   억원 전년       감소,Securities
코스피  외인 기관  사자 에     선 회복,Securities
홍콩법원    부동산 개발업체 헝다에 청산 명령,Securities
롯데정보통신   분기 영업익    억 전년비        ,Securities
포스뱅크  상장 첫날      급등,Securities
 속보 이복현  김건희 여사 주가조작  증거 있으면 기소했을 것 ,Securities
    랠리  필라델피아반도체지수  년간     급등 더 오른다,Securities
  바이오팜   분기 영업익    억 흑자전환,Securities
스튜디오삼익  일반청약 경쟁률     대  증거금  조   억,Securities
  바이오팜 작년 영업손실    억원 적자 축소,Securities
 속보 이복현  홍콩     판매경로 조사 뒤 제도개선 검토 ,Securities
키움증권    주식옵션 기초자산    종목으로 확대,Securities
스튜디오삼익 일반청약 경쟁률  천   대   증거금 약  조원,Securities
교보증권  연계영업 강화 위한      센터 현판식 개최,Securities
마니커에프앤지  지난해 영업익   억 흑자전환,Securities
   중국 규제 시동에 반사이익 가능성 삼바   만원선 돌파 핫종목 ,Securities
싱가포르  통화정책  연속 유지    인플레 점진적 완화 ,Securities
 도 공매도 막는다 보호예수주식 대여 전면중단  추가 부양책 ,Securities
키움증권   주식옵션 기초자산    종목으로 확대,Securities
스튜디오삼익  일반청약 경쟁률     대   증거금   ,Securities
 속보 이복현  홍콩     조사 중 끝나면 결과 발표 ,Securities
메디아나  지난해 매출    억 역대 최대치 경신,Securities
대신증권  세전수익률 연   대 우량 채권 온라인 특판,Securities
 특징주  태영건설우  공사 정상화 기대감에 상한가 기록,Securities
금융투자협회  금융투자상품 이해 과정 개설,Securities
금호전기  전환가액    원으로 하향 조정,Securities
동아쏘시오홀딩스  내달  일 기업설명회 개최,Securities
모토닉  주당    원 결산 배당,Securities
 증시신상품  대신증권  세전 수익률 연   대 채권  종 특판,Securities
스튜디오삼익  청약 경쟁률     대   증거금   ,Securities
신한    프로 디지털 아카데미   기 교육생 모집,Securities
메디톡스  뉴라덤    최대 쇼핑몰  라쿠텐  론칭 ,Securities
키움증권  미국주식옵션 기초자산    종목으로 확대,Securities
우주일렉트로닉스   디자인콘        년 연속 참가,Securities
 마켓인 포스코어    억원 규모 시드투자 유치 한투   등 참여,Securities
 칩톡 반도체 장비 싹쓸이 한   멀고 먼  자급자족 의 길,Securities
대신증권  세전수익률 연   대 우량 채권 온라인 특판 ,Securities
스튜디오삼익  공모 청약 경쟁률     대    청약 증거금  조원 모아,Securities
모토닉  주당    원 현금배당 결정,Securities
키움증권   주식옵션 기초자산    종목으로 확대  다양한 투자전략 구사 가능 ,Securities
스튜디오삼익  일반청약 경쟁률     대   기록 증거금  조 ,Securities
   하이브           팝 집중하는     나온다,Securities
   산업 특성  대기업보다 중기 잘 맞아 ,Securities
       반도체    반도체     최대 순매수,Securities
 바이든 지원 올트먼 협력  기대감에 삼성전자   권영훈의 증시뉴스      ,Securities
다올투자증권 작년  분기 흑자전환,Securities
신한투자증권   프로 디지털 아카데미   기 교육생 모집,Securities
주식형펀드도 미일  훨훨  한중  골골 ,Securities
반도체 보조금 푸는        삼성전자 주가 들썩  투자    ,Securities
밀항 시도하다 붙잡힌  영풍제지 주가조작  주범  구속심사 포기,Securities
 올댓차이나  중국 증시 상승 출발 상하이지수       ,Securities
   라씨로 포스뱅크  상장 첫날     대 강세,Securities
  증권    시간 실시간 환전 거래 서비스 제공,Securities
수장까지 쫓기듯 퇴임  카카오페이   울고  토스   웃고 ,Securities
에이치앤비디자인  주식 발행 및 상장금지 가처분 신청 각하,Securities
 한세대 한 번 있을 투자 기회  금리 인하 예상에 신흥국 채권 인기,Securities
개인      오른       미국반도체   집중 매입,Securities
 특징주  아이텍  흑연에서 상온 초전도성 발견     그래핀 신사업  부각 ,Securities
 인사 주택금융공사,Securities
메디아나  지난해  분기 영업익   억원  환차손실 영향 ,Securities
사학연금 지난해 운용수익  조    억  역대 최대   수익률      ,Securities
우리운용 통합법인 출범 순자산   조   위권 운용사로,Securities
엘앤에프  코스피 이전 상장 첫날 약세   대 하락 중,Securities
우리자산운용  통합법인 출범 우리글로벌운용과 통합 마무리,Securities
포스뱅크  코스닥 첫 날      급등,Securities
 한경유레카 특징주  기아  기대되는 주주환원정책,Securities
오늘의 증시 메모  월   일 ,Securities
교보   연계영업 강화 위한      센터 현판식 개최,Securities
한국증권금융  이영찬 상무 신규선임,Securities
기후테마 투자 뮤추얼펀드에 자금 유입  년 새 최저,Securities
현대건설 금호건설  힐스테이트 어울림 청주사직  월 분양 예정,Securities
키움증권  미국주식옵션 기초자산    종목으로 확대,Securities
 특징주  태영건설  공사대금 이슈 해소에 상승,Securities
유진투자선물  실전투자대회  커뮤니티 리그 시즌    개최,Securities
   클라우드 기대로 급등했던 삼성      월 내내 부진  반등 요인은 ,Securities
골드만삭스가 추천한 종목은    실적 발표 전에 사야 ,Securities
대원전선  작년 영업익    억 전년비          주목  공시 ,Securities
인텔리안테크    억 규모 자기주식 취득 신탁계약 체결,Securities
코스피  외국인 기관  사자  전환     선 넘어서,Securities
타이푼미디어             세라젬 부스에 특화     납품,Securities
 특징주 레이저쎌      시간 전력 줄일 신기술 성과 기대 강세,Securities
인텔리안테크    억 규모 자사주 취득 신탁계약,Securities
테크엘  전환가액     원으로 상향 조정,Securities
아이티아이즈  전환가액     원으로 상향 조정,Securities
스카이라이프  다음달  일 기업설명회 개최,Securities
메디아나  지난해  분기 영업이익   억 전년        ,Securities
유진투자선물  해외선물 실전투자대회  커뮤니티 리그 시즌     개최,Securities
인텔리안테크    억 규모 자사주 취득 신탁계약 체결,Securities
사학연금  지난해 수익률        역대 최고 ,Securities
통안채   일물        에  조원 낙찰  응찰  조   억원,Securities
삼성  협력사 대금  조    억원 조기지급    경기활성화 지원 ,Securities
지난해 역대급 투자했지만   제조업  올핸 찬바람,Securities
지난해     발행금액   조   억원  전년       감소,Securities
 한국판            미국반도체    연간       수익,Securities
크래프톤  지난해 연결 영업익     억  호실적 ,Securities
   마켓워치  사학연금  지난해  역대최고 운용수익  달성      조원 규모,Securities
골드만삭스     애플 브로드컴 실적 발표 전에 사라 ,Securities
한투운용  엔터주 집중 투자하는     포커스    출시,Securities
일생에 단 한 번 기회 신흥국 채권 투자하는 월가,Securities
대신증권  연   대 우량 채권 온라인 특판,Securities
금감원  펀드 가입 전 등록업체인지 확인해야 ,Securities
     지난해 영업이익  억 전년         ,Securities
교보증권  혁신점포 호      센터 개점    맞춤형 상품 제공 ,Securities
 아직 바닥 아니다     차전지 대장주 적자 전망 나와,Securities
한국증권금융  이영찬 상무 신규 선임,Securities
프로티아  지난해 해외   개국 신규 진출 성장세  ,Securities
한국증권금융  이영찬 상무 신규 선임,Securities
한투운용  엔터주 집중투자         포커스     출시,Securities
  증권   년 만기     공모,Securities
개인투자자용 국채  투자매력 있지만  이것  바꿔야  더 머니이스트 조재영의 투자 스토리 ,Securities
 시황  코스피   외인 기관 사자 에 장중     선 회복,Securities
작년     발행금액   조    억   전년       ,Securities
한국증권금융  이영찬 상무 신규 선임,Securities
사모펀드도   투자비중 축소  또 축소   ,Securities
교보증권  영업 강화 위한      센터 현판식 개최,Securities
크래프톤  깜짝 실적 에 장초반 강세   주 신고가 핫종목 ,Securities
오뚜기  설 앞두고 협력사 하도급대금    억 조기 지급,Securities
크리에이츠     쇼 성황 속 마무리 캘러웨이 등 호평 이어져,Securities
메디아나   분기 영업익   억 전년비        ,Securities
재벌집 막내아들 제작사  래몽래인   컴투스그룹에서 빠진다,Securities
데브시스터즈 신임    에 조길현 스튜디오킹덤 공동대표,Securities
메디아나  작년    영업이익   억    만원 전년        ,Securities
씨젠    와 협업 소식에 강세 주가     급등 핫종목 ,Securities
    앞둔 레딧 기업가치 반토막       억 달러    억 달러 ,Securities
 그레이스케일 매도세 둔화에  비트코인      만원대 회복 코인브리핑 ,Securities
   오전시황 코스피  동학개미 순매도에도      돌파,Securities
교보   연계영업 강화를 위한      센터 현판식 개최,Securities
한빛소프트  신작  그라나도 에스파다   출시일 확정  급등 ,Securities
우리자산운용 통합법인 출범  상품 라인업 확대 경쟁력 강화 ,Securities
작년     상환액  전년 대비     증가     조 천억,Securities
     인도서 대체투자 발굴  뭄바이 사무소 설립,Securities
한국증권금융  이영찬 상무 신규 선임,Securities
화일약품  행정처분으로 인한 상장유지 문제없다 ,Securities
크리에이츠      참가    신제품 공개,Securities
한국증권금융  이영찬 상무 신규 선임,Securities
 특징주  포스뱅크  코스닥 상장 첫날      급등  따따블 은 실패,Securities
한투운용  엔터 대장주에 집중 투자하는       포커스      출시,Securities
작년     발행   조   억  전년      감소  투자    ,Securities
 지금 사서  개월만 기다리세요   더블 배당  나오는 종목은,Securities
 특징주  레이저쎌  삼성전자  꿈의 메모리      램 개발 소식에 독자개발 면광원 레이저기술 부각,Securities
한투운용   팝 집중투자     출시   대 엔터주 비중     ,Securities
더블유씨피  작년    영업이익   억    만원 전년        ,Securities
삼성운용       미국반도체    개인 올해    억 순매수,Securities
하이투자증권  국내     투자  하이 마이트리     랩  판매,Securities
빅테크 반도체 실적        고용지표 증시 분수령 이번주   증시는 ,Securities
골드만   모건  캐리트레이드 다음 타자는 유로 ,Securities
  중국 바이오 규제 법안 발의 삼바   대  강세 ,Securities
 특징주 상장 첫날  따따블  달성했던 현대힘스  이튿날    대 하락,Securities
코스피 이전 첫날   대 급락한 엘앤에프 시총   위 기록,Securities
신흥국 채권 인기   한세대에 한번 있을까  하는 투자 기회 ,Securities
   베이비몬스터  파리타 로라  스턱 인 더 미들  비주얼 공개,Securities
키움증권  미국주식옵션 기초자산    종목으로 확대,Securities
키움증권  미국주식옵션 거래 종목    개로 확대,Securities
키움증권   주식옵션 기초자산    종목으로 확대  투자    ,Securities
한국캐피탈   사랑의 밥퍼  나눔 봉사 실천,Securities
 오후 시황 코스피 상승기류     선 돌파,Securities
교보증권  혁신점포  호      센터 개점 현판식 개최,Securities
 채권 투자자 주목  대신   세전수익률 연   대 우량 채권 특판,Securities
화일약품  행정처분에도 영업 상장유지 문제없어 재고 판매 가능 ,Securities
한국증권금융  이영찬 신임 상무 선임,Securities
인공지능 피트니스 플랫폼 하이랙스  네 번째 직영센터 여의도점 개점,Securities
거버넌스포럼  금융위원장 거래소 이사장에 공개서한 보낸다,Securities
 인사  한국증권금융,Securities
신한   취업연계 프로그램  프로 디지털 아카데미   기 모집,Securities
크리에이츠      쇼 성황     신제품 공개에 글로벌 기업 호평 ,Securities
 박진영  양현석도 샀대  주가 뛰나 했더니     와이지엔터  뚝 ,Securities
      미국반도체    개인투자자 꾸준한  베팅    비결은 ,Securities
금주 애플    알파벳 등 실적 주목      고용지표도 관심,Securities
우리은행   상반기 금리인하 기대 꺾여  월 환율 상단     원 ,Securities
