titles,category
광동제약  안과제품군 확장  노안 치료제 후보물질 도입,Industry
  하이닉스  첫 여성 연구위원  오해순 부사장  업턴 전환 올해는 낸드 차례 ,Industry
세노바메이트로  흑전 시기 앞당긴   바이오팜  올해가 원년  종합 ,Industry
올 상반기 조선업 일자리    증가 전망 주요 업종 중 최고,Industry
아시아나항공  인천공항 카운터에 로댕 작품 전시한다,Industry
김포  오전    시 출근시간 서울 진입 광역버스  개 노선 신설,Industry
포켓몬빵   년도 판매  위 매출  천억 돌파,Industry
포켓몬빵     년 매출     억원,Industry
포켓몬빵 작년 매출  천억 넘고 판매량  위,Industry
데브시스터즈  조길현 신임     내정 최고경영진   인 체제 로,Industry
즉석밥 등 쌀 가공식품 수출 역대 최대치 기록,Industry
즉석밥 등 쌀 가공식품 수출 역대 최대치 기록,Industry
쌀 가공식품 수출액       증가,Industry
최대치 기록한 쌀 가공식품 수출액,Industry
최대치 기록한 쌀 가공식품 수출액,Industry
    설 앞두고 협력사 납품대금     조 조기 지급,Industry
 배터리 교환에 단  분     배터리 교체 전기차 보급 속도,Industry
    설 앞두고 협력사 납품대금  조    억원 조기 지급,Industry
 인사  한국자산관리공사,Industry
농식품부  설 맞아 한우 할인판매 행사 열어,Industry
한우 최대     할인구매 가능한  소프라이즈 ,Industry
농식품부  설 맞아 한우 할인판매 행사 열어,Industry
한우 최대     할인구매 가능한  소프라이즈 ,Industry
손경식 회장  올해 목표 노동개혁 중대재해법 처벌 능사 아냐 ,Industry
   글라스 홈씨씨 인테리어  북미 최대규모 바닥재 전시회 참가,Industry
포스코이앤씨  부산 촉진    구역 재개발 마수걸이 수주,Industry
과학기술정보통신부      자문단 출범식,Industry
     자문단에 환영사 하는 이종호 장관,Industry
농식품부  착과감소보험금 보장 상향 등 재해보험 확대 ,Industry
 사과 생산 안정되도록  농식품 차관  사과농가 간담회,Industry
  관광객  호텔 예약단가 두배로  인당 구매액은 적어  종합 ,Industry
산업부  무탄소에너지      이니셔티브의 추진 동향 및 향후 계획 발표,Industry
산업부  무탄소에너지      이니셔티브의 추진 동향 및 향후 계획 발표,Industry
산업부  무탄소에너지      이니셔티브의 추진 동향 및 향후 계획 발표,Industry
산업부  무탄소에너지      이니셔티브의 추진 동향 및 향후 계획 발표,Industry
무탄소에너지      이니셔티브의 추진 동향 및 향후 계획 발표하는 강경성 산업부  차관,Industry
산업부  무탄소에너지      이니셔티브의 추진 동향 및 향후 계획 발표,Industry
산업부  무탄소에너지      이니셔티브의 추진 동향 및 향후 계획 발표,Industry
무탄소에너지      이니셔티브의 추진 동향 및 향후 계획 발표하는 강경성 산업부  차관,Industry
무탄소에너지      이니셔티브의 추진 동향 및 향후 계획 발표하는 강경성 산업부  차관,Industry
 중국 열쇠 쥔  포스코퓨처엠  장 차관만  명이 찾았다,Industry
한미그룹     와의 통합  부채문제 해결에 공격적 운영까지 기대 ,Industry
딥페이크 파문에   엑스  아동 성착취물 단속팀 신설 ,Industry
단상 오르는 강경성 산업부  차관,Industry
무탄소 에너지 동향과 계획 설명하는 강경성  차관,Industry
이재용  상생  경영 삼성  설 맞아 내수경기 활성화 지원,Industry
손경식 경총 회장  중대재해법 확대  노동문제 타협문화 부족 때문 ,Industry
세계적    아티스트가 반한  이    의 정체는 ,Industry
무탄소에너지      동향과 계획 발표,Industry
무탄소 에너지 동향과 계획 설명하는 강경성  차관,Industry
탄소중립 위해 무탄소 에너지 최대한 활용,Industry
무탄소에너지      동향과 계획 설명,Industry
무탄소 에너지 동향과 계획 발표,Industry
무탄소 에너지 동향 설명,Industry
무탄소 에너지 동향과 계획 발표,Industry
     평촌 데이터센터  행안부 장관 표창 수상,Industry
   치킨  태국 방콕에  센트럴월드점  오픈,Industry
지난해 전국 항만 컨테이너 물동량 역대 최대,Industry
컨테이너 물동량 역대 최대  분주한 부산항,Industry
손경식 경총 회장  절박한 호소에도 영세사업장 중대재해법 적용 ,Industry
컨테이너 물동량 역대 최대  부산항에 쌓인 컨테이너,Industry
컨테이너 물동량 역대 최대  분주한 부산항,Industry
분주한 부산항,Industry
컨테이너 가득 찬 부산항,Industry
컨테이너 가득 찬 부산항,Industry
지난해 항만 컨테이너 물동량 역대 최대치,Industry
 세노바메이트  효과   바이오팜 흑자전환,Industry
 머니 포토  질의에 답하는 이동근 경총 부회장,Industry
지난해 전국 항만 컨테이너 물동량 역대 최대,Industry
삼성 현대차  명절 경기활성화 지원   협력사 물품대금    조씩 조기 지급,Industry
한경협  기부문화 확산위해 공익법인 주식관련 규제 완화를 ,Industry
 머니 포토  경총  노동 분야 전반 국민 인식 개선 필요 ,Industry
삼성전자  청소년단기쉼터 환경개선 위한 후원금  억    만원 전달,Industry
 그래픽  올해 상반기 일자리  조선 철강  늘고  섬유  줄고 ,Industry
 인력난 풀자   취업중심 특성화고     개교 집중지원,Industry
    설 앞두고 협력사 납품대금  조    억원 조기 지급    전자 등  개 계열사  최대  주 앞당겨 지급,Industry
 여기도 쿠팡이   강원도 산골짜기도  쿠세권 ,Industry
중기부  인력난 해소위해 특성화고 집중 지원,Industry
 예비 초기 도약  창업패키지 모집 사업화 전과정 지원,Industry
  바이오팜 지난해  분기 흑자 전환  올해 미국 처방  위 달성할 것 ,Industry
최태원 손에 든 제안서   년 전  이병철 잡스  회동의 데자뷔  박동휘의 재계 인사이드 ,Industry
공정위 영화  공정하지 못한 자   왓챠 웨이브 티빙에서 무료,Industry
올해 상반기 일자리 기상도  조선 철강  맑음   섬유  흐림  ,Industry
    설 앞두고 협력사 납품대금  조    억 조기 지급,Industry
송미령 농림장관  쌀값 안정 위해 전략작물직불제 확대 ,Industry
사우디서 한국은   건설 잘하는 나라  서  첨단기술 나라  로  한 중동  석유없는 미래  준비한다 ,Industry
 머니 포토  경총  중대재해예방지원센터 신설  다양 방면 지원확대 ,Industry
 유연근무 육아휴직 확산  내달   일까지 우수기업 신청,Industry
    협력사 납품대금  조    억원 조기 지급,Industry
 대통령 한동훈  대통령실서 첫 오찬  민생 이야기 나눌 것 ,Industry
 영상  친이란 민병대 드론 공격에 미군 수십명 사상 미  보복할 것 ,Industry
 게시판  국립환경과학원 안전성평가연  동물대체시험 활성화  맞손 ,Industry
농식품장관  올해 쌀값 안정위해 전략작물직불제 확대 시행 ,Industry
중기부  올해 예비창업자 창업기업  천   개에 사업화자금 지원,Industry
공정위가 스릴러 영화 만든 까닭은 ,Industry
송미령 농식품부 장관  벼 재배 면적 선제적 감축해 쌀값 안정 ,Industry
올해 창업기업     개 선발 사업화 전 과정 지원,Industry
 사업화 전 과정 지원  예비 초기 도약창업패키지 참여 기업 모집,Industry
중기부  취업 중심 특성화고    개교 선정  인력난 해소 지원 ,Industry
 포토      년 경총 출입기자 신년 간담회,Industry
손경식 경총 회장  국회 정치 노사관계 모두 타협의 문화 필요 ,Industry
 포토  손경식 회장  중대재해법 보완입법 필요 ,Industry
삼성 최대    노조  닻 올린다   일 첫 총회,Industry
한경협   기술개발   도입된 규제  등   건 한시적 유예 건의,Industry
물티슈도 이제는   물티슈  한울생약  리꼬 베이비 물티슈로 수출탑  천만불 달성,Industry
냉혹한 성과급의 계절     잔치  삼성  빈손 ,Industry
 포토  인사말하는 손경식 경총 회장,Industry
 포토  경총  출입기자 신년 간담회,Industry
       폐식용유로 저탄소 연료 만든다,Industry
애플 엔비디아 사로잡는다  나노 파운드리 경쟁 본격화,Industry
삼성 협력사 물품대금  조 조기 지급,Industry
삼성도 낙점  유리 반도체 기판  뜬다,Industry
   한국사업장  최고전략책임자에 정정윤 임명 내수 시장 전략 강화,Industry
 일문일답 손경식  주  시간 근로  내용 나무랄 것 없지만  ,Industry
 머니 포토  중대재해처벌법  경총 입장은,Industry
 전기차 한파 에   엔솔 성과급 반토막 평균  기본급      ,Industry
홈플러스  한 판에  천   원  미국산 계란 전량 소진,Industry
 신년기획 제네시스  독일 럭셔리카와 경쟁  한국 브랜드 가치 높였다,Industry
 신년기획 현대차  사우디에 연간  만대 합작공장,Industry
 직원 대부분 고령  매일 살얼음판    중처법에 뿌리기업  고사  위기,Industry
 인사  주택금융공사,Industry
 중대재해법 확대  고용장관 만난 상인들  뭐부터 해야 해요  ,Industry
 단독  롯데     컨트롤타워  본격 가동 정보통신 출신 현종도    이끌어,Industry
 신년기획   현대건설 인재 최고대우  해외기업 스카우트 쇄도 ,Industry
 신년기획       가스처리 파이프랙  중동 에너지  대동맥 된다,Industry
