titles,category
증권사 자사주 매입 확산  주목  주가 반등 계기되나,Securities
부실    우려에 캐피털사 이달만  조 갚아,Securities
   에너지솔루션   분기 영업적자 불가피  목표가 ,Securities
블룸버그  미군 공격당해   명 사상  유가 급등 전망 ,Securities
 클릭  종목  넥슨게임즈  숫자보다 중요한 투자포인트 ,Securities
현대오토에버  전략 사업 중장기 성장 가능성 유효   ,Securities
높아진 조달금리에 자산매각 계열사 차입해 급한불 꺼  시그널 ,Securities
 클릭  종목  애경산업  올해 생활용품 실적 아쉬울 것 목표가  ,Securities
  에너지솔루션  회복 방향성에 주목해야 투자의견  매수   신한,Securities
   엔솔  보조금 빼면  분기 적자 기록할 것 목표가   하나,Securities
  에너지솔루션  불확실성 확대 구간 목표주가  하향  하나,Securities
현대모비스  올해 외형 성장 더딜 것 수익성 개선 필요 유안타,Securities
   엔솔 목표가   만원으로      올해 실적 하향 조정 ,Securities
 시그널    포스코 미래에셋 박차고 나와     억 벤처펀드 만들었죠 ,Securities
 이번주     곳 실적 발표 증시 단기 방향성 결정 ,Securities
호텔신라  손익 보릿고개 넘는 중 단체 관광객에 주가 달렸다 대신,Securities
미리보는      주총  대 이슈는   소유분산기업 경영권분쟁 배당정책 기관주주권   투자    ,Securities
호텔신라  예상된 실적 부진 접근 가능한 주가 수준 한투,Securities
 코스피  당분간 반등 시도 단기 매매 업종 순환매 대응 가능  대신,Securities
 호텔신라   분기 매출 회복 지연 전망 목표가   대신,Securities
지난해 신규 벤처펀드 약정금       하반기 개선세,Securities
  이노텍   실적 모멘텀 안 보여  목표가     ,Securities
세종텔레콤  국가철도공단 장항선 복선전철 신호설비 신설 공사 수주,Securities
  월 강세 업종이 한해 이끌어 반도체 비중 늘려야 ,Securities
금감원   년간 부실 금투사   곳 직권말소  투자    ,Securities
   마켓워치 한투   한양대  포스코 사내벤처 출신에 투자,Securities
케이뱅크 턱밑 추격 토스뱅크 케뱅    로 반전 꾀할까,Securities
김주현 이복현  오늘 국회 출석 홍콩     격돌,Securities
  에너지솔루션  시총   조    조 트레이딩 권고 하나,Securities
한화   살 주식 없는    월 중소형주 중심 매매 전략 유효할 것 ,Securities
금감원  부실 금융투자업자   곳 직권말소,Securities
현대모비스  인건비 증가  목표주가   만   만 하나,Securities
 거버넌스워치 서울가스 김요한    억짜리 승계  돈줄     솔루션즈,Securities
엔비디아     이어   랠리 주도할 반도체주는   ,Securities
 복붙  표준약관 믿었다가 수백억 손실      증권  위너스운용에 패소,Securities
 나홀로 플러스 수익률  신한  황재수  최종  위  인터뷰  ,Securities
 저랑 일하기 싫어요   젊은 사무관 급발진에  당황   금융당국 포커스 ,Securities
 데이터로 보는 증시 해외 주요 증시 동향  월   일 ,Securities
챗   의 두 얼굴    활용이 안긴 증권가 과제,Securities
증권사 탄소배출권 사업 박차 이미지 제고  잰걸음 ,Securities
  셀   고형암  세포치료제 개발 승부수,Securities
금감원  부실 금융투자업자   곳 직권말소 퇴출,Securities
    주간브리핑     애플 실적  빅테크 어닝시즌 분수령  국가 전산시스템 개선 대책도 주목,Securities
  규제 완화 기대감에  휴우   게임  다시  들썩 ,Securities
하나     엔솔  정책 리스크 증폭 목표가   만   만 ,Securities
  월      레딧  기업가치   억달러 목표  년 만에 반토막,Securities
 단독 신한  판매한  환매중단  피델리스 펀드  추가 피해구제  난항 ,Securities
뉴욕증시  파월 발언 수위 대형 기술주 실적에 촉각  출근전 꼭 글로벌브리핑 ,Securities
 이번주 증시 캘린더  포스뱅크도   배 상승  동참하나 증시 부진 속    는 과열,Securities
 포스기 제조  포스뱅크  코스닥 입성   클라우드 기반 신제품 개발 ,Securities
 기관 시각 넉넉해진 공무원연금  올해 여유자금  조 굴린다,Securities
 개미털기 하는거지       약빨 떨어진 비트코인  관련종목도  뚝 ,Securities
     핀셋해법   고수익 원하면 고위험 책임  정부 구제 시그널 위험 ,Securities
코스피로 이사 가는 엘앤에프 코스피    편입 여부는 미지수,Securities
테슬라 주가 폭락으로 머스크 세계  위 부호 탈락,Securities
올해 주총 이슈는  소유분산기업 경영권 분쟁 배당정책 ,Securities
상사업계  작년 매출은 줄었지만 영업익은 늘어  신사업 효과 ,Securities
     핀셋해법   방패없이 들어간 전쟁터 위험분산 도구로 쓰인 개인들 ,Securities
금감원    개 부실 금융투자업자 직권말소,Securities
금감원  부실 금융투자업자 직권말소 유의사항 안내,Securities
 데이원자산운용 등 부실 금융투자업자 직권말소  금감원,Securities
금감원  부실 자산운용사 투자자문사 등   곳 퇴출,Securities
 기고 주식회사 다수결 원칙 허무는 상법 개정안,Securities
금융투자업자   곳 무더기 직권말소 향후 사업 영위 불가,Securities
회생기업 쓸어 담는   그룹  범현대  노현정 남편 건설사도 가져간다,Securities
  년 투자한 골프존 슬슬 손 떼는   자산운용,Securities
  업종     첫주자  이에이트  흥행 성공할까,Securities
자기자본 미달 등 부실 금융투자업자   곳 퇴출,Securities
 니케이 옵션    억 손실 공방    증권 책임 미수금 회수 빨간불,Securities
금감원  부적격 사모펀드 일임업자   사 퇴출,Securities
금감원  직권말소 요건 해당되면 검사 없이 금융투자회사 퇴출 ,Securities
데이원자산운용 등록 직권말소 금감원  부실 금투사 적시 퇴출 ,Securities
 수익률이       널뛰는 천연가스 가격에     투자자  현기증 ,Securities
경쟁사에서도 존경받는     의 아버지  배재규 사장,Securities
줄어든 증시주변자금 등돌린 개미에  천수답  증시 우려,Securities
트럼프 돌풍에 신재생에너지주  휘청휘청 ,Securities
김원규 이베스트투자증권 대표    그룹 편입 후 사업 다각화 기대,Securities
 매그니피센트  질주  빅테크     투자 매력도 상승,Securities
    대부의 조언  예측말라 개인은 장기 분산투자가 답 ,Securities
친이란 민병대 드론 공격에 미군  명 사망 중동 확전 위기 고조,Securities
문턱 높아진     심사 최장  개월 넘어섰다,Securities
     일 올해 첫      파월  금리인하 힌트 준다,Securities
부동산       개 사업장별 위험등급 매겨 충당금 차등화,Securities
 주간경제지표      년  월   일자,Securities
테슬라의 굴욕    서 가장 먼저 빠져야 할 기업 ,Securities
 경합주 표심 잡자  바이든  반도체 보조금 푼다 인텔      유력,Securities
 격동의 황제주    아 옛날이여    생건  중국 직격탄서  허우적 ,Securities
베이조스 전처  아마존 주식   조원어치 팔았다  더 헤어질 결심 ,Securities
중국 증권당국  내일부터 제한된 주식대여 금지,Securities
등 떠밀린 캐피털사 이달만  조 빚 갚아,Securities
조달금리 높아지고 투자자도 외면 자산매각 계열사 차입해 급한불 꺼  시그널 ,Securities
매물 나온 한국포스증권 인수후보 우리금융 거론,Securities
 러브콜  거부한 유승민  당을 지키겠다  권은희 내일 탈당,Securities
쌀포대로 가방 만들고 일회용 컵 줄이고    로 일자리까지,Securities
서초 대형마트 의무휴업 변경 첫날  편해요  주변 상권  영향 적어 ,Securities
 오늘의   인   증권사 신입  기므상 서 증시 전문가 돼  닛케이  만이요  ,Securities
 반도체 팹리스  제주반도체  석달만에       껑충 ,Securities
  대 자산가  대주주 양도세 기준   억으로 완화됐다는데   세무 재테크     ,Securities
 빅테크 양호한 실적 예고   코스피 제한적 반등 가능성  주간 증시 전망 ,Securities
리노공업  온디바이스   시장 확대 수혜   슐랭 가이드 ,Securities
빠르게 성장하는 생성형   에 베팅 중소형    종목 집중  이런 펀드 어때요  ,Securities
  부실 직격탄 부동산운용  빅   임직원   년만에 줄었다,Securities
 재테크 서적 무료 증정 으로     유인  가짜 주식 앱  피해 속출,Securities
새해 돌풍    테마주    배씩 올랐다,Securities
한진  운영자금 마련 사모채    억 발행,Securities
 사자  돌아선 외국인  삼성전자에 집중,Securities
 반짝 반등  에코프로 패밀리   추가 하락      바닥 탈출 ,Securities
다올투자증권  분기 영업익 흑자전환,Securities
개인  증시 부진에도 올들어  조원 넘게 순매수,Securities
   마켓워치  증권사 단기차입 의존  이달 전단채   조 조달,Securities
 무탄소 추진선 시장 개척  김동관의  퍼스트 무버  승부수,Securities
판매사  위험등급 산정  의무화에 코스콤  공동인프라 서비스  출시,Securities
    충당금 더 많이 쌓아라     당국      옥석 가리기  압박,Securities
순자산    배 뛴  펀드 테마형    도 출격 대기,Securities
대세 된  벚꽃 배당  현대차 금융지주  더블 배당   담아라,Securities
 이번주 추천주  박스권 뚫을 실적  주목 인터플렉스  갤    수혜  기대,Securities
고금리에 흔들렸던 리츠   배당     유망주로,Securities
뉴욕 증시  새해 첫      회의  월 금리인하 불투명,Securities
테슬라 추락에도 서학개미는  공포에 사라 ,Securities
상하이 증시     월 제조업      개월 연속    밑돌 듯,Securities
 실적 경고등     전자계열  인방 올해는 다를까,Securities
코윈테크  올     성장  차전지 종합장비 솔루션  도약 ,Securities
비만 치료에 꽂힌 큰손 펩트론  순위로 담았다,Securities
금감원  건설 조선 회계처리 중점 심사,Securities
  경기 부진에 카지노  신저가 눈물,Securities
내달  일 올해 첫      결과 주목  증시풍향계 ,Securities
 주식 투자  년새   조 늘어  테슬라  여전히  위,Securities
 우리도 가자  설 연휴 해외여행  역대 최대  이 주식도 같이 난다,Securities
금융지주 지금 투자땐  꿩먹고 알먹고  배당,Securities
전기차 기침에  차전지  몸살 연초 이후 시가총액   조 증발,Securities
 일 새벽      글로벌 증시 촉각,Securities
  반도체     성적  엔비디아보다    가 좌우했다,Securities
새해부터 터진 해킹사고에 월가  사이버보안   대세,Securities
 가짜 주식투자 앱  조심하세요,Securities
 올     시장  월배당 반도체 채권이 주도 ,Securities
    약발 떨어진 비트코인 관련   눈물 ,Securities
하도급대금 늑장 지급  위는 한국타이어,Securities
 월 코스피      꼴찌      월엔  상반기 반등장  준비하라는데,Securities
 비트코인 지금   주만에 상승 반전 전주        ,Securities
밀항하려다 잡힌  영풍제지 주가조작  주범에 구속영장 청구,Securities
 스타즈      바사   스카이백스  성장세 사업 고도화 잇단 결실,Securities
 주간증시전망 증시 반등 제한적 실적 발표 주목해야,Securities
돌아온 외국인 수급    알고보니 삼성전자  외사랑 ,Securities
  월도 아니라고  진짜 힘 빠지네  금리인하  대체 언제   월      촉각,Securities
  부자 아빠 가난한 아빠  책 드려요     앱 깔았더니 벌어진 일,Securities
  전자 새 먹거리로 떠오른  냉난방공조  핵심기술은,Securities
오른 공사비 무시하다 막판에  회계절벽  금감원  건설업 집중점검,Securities
이차전지 시총  줄줄이 하락  올해   조 증발 ,Securities
검찰  영풍제지 주가조작 주범 구속영장 청구,Securities
작년 하반기 창업 영세 소상공인  카드수수료 평균   만 원 환급,Securities
 반도체는 역시 엔비디아  이젠 옛말  수익률  위  비결은 이 종목,Securities
리포트 나오자     급등    로봇 모멘텀 부각될 종목은 ,Securities
 반도체  차전지  실적에 출렁인 증시    반등 제한적  이유는,Securities
개미들 올해만  조원 순매수 수익률은  대부분 손실,Securities
고려거란전쟁이 여의도에 주는 교훈  기자수첩 ,Securities
 단통법 폐지 에   지지층도 과반  찬성  눈길,Securities
 반등 시작       배터리 버블  붕괴    개미들은 에코프로  탈출 중,Securities
 만년적자  엑세스바이오  코로나로 환골탈태 급등주 지금은 ,Securities
 가짜 주식거래앱 조심하세요 ,Securities
금감원   건설 조선 등 수익 비용 인식 제대로 해야 ,Securities
 빅테크 실적 힘입어 제한적 반등       는 변수   주간증시전망 ,Securities
  우려에 금감원  건설 조선업 회계처리 집중점검,Securities
   마켓워치  한진  단기 사모채    억원어치 발행  조달금리 소폭 하락 ,Securities
지난해 랠리 일등공신이었는데 이차전지   올해 시총   조 증발,Securities
새해 벌써      급등      광풍에 테마주  활활 ,Securities
금감원  올해 건설업  회계절벽  집중감시,Securities
호실적 업고 날아오를 종목은   리노공업 더블유게임즈  주목    슐랭가이드 ,Securities
건설 조선업 회계처리 집중점검 원가계산 조작 우발부채 살핀다,Securities
가짜 주식거래앱 사기 기승 금감원  소비자경보  주의  발령,Securities
수주업체 매출액 뻥튀기 여전 금감원  회계분식 집중 점검 ,Securities
 주식투자 책 무료 증정  가짜 앱 설치 유도 금융사기  주의 ,Securities
 공모주 더 많이 받게 해줄게      사기 주의보,Securities
       동결 전망 파월 발언 주시 주간증시전망 ,Securities
 수주산업 회계 위반 증가  금감원  중점심사 엄정 관리 감독,Securities
공모주 더 싸게  많이 받을 수 있다고  금감원  금융사기 주의 ,Securities
       수익률  가짜 주식거래 앱 주의보  금감원,Securities
 건설 조선업  회계처리 시 주의하세요 ,Securities
가짜 주식거래 앱 설치 유도 사기 기승 금감원  적극 신고 권고 ,Securities
 주간 추천주   기대감 고조  증권가가 선별한 종목은 ,Securities
 책 공짜로 드려요  유인해 사설 증권앱 설치 유도 금감원  소비자경보 발령,Securities
건설 조선  회계절벽  막는다   기업 감사인에 사실상  경고 ,Securities
금융   부동산     시공사 의존 건설사 위기 때 위험 증폭 ,Securities
연예인 내세워  우량주 추천  인스타 광고에 낚여  억 날렸다,Securities
금감원  수주산업 결산 외감 유의사항 마련,Securities
 건설 조선  수주산업 분식회계 끊이지 않아 금감원  올해 중점심사 ,Securities
 따상 공모주 싸게 팔게요  연예인 사칭 가짜 주식앱  주의보 ,Securities
 주간추천주  맞춤형 메모리 수요 늘어  개미는 팔아도 증권가  사라 ,Securities
돌아온 외국인에 증시 반등 이어질까 주간증시전망 ,Securities
신한금융 에너지 취약계층에  사랑의 연탄 나눔 ,Securities
 탈원전 자금난  원전 중소 중견기업에   대 저리 금융지원,Securities
   증시레이더 엔비디아 편입     고공행진  포스코그룹 약세,Securities
테슬라  공포에 사라더니  마이너스  억인데 어떡해  눈물,Securities
 이번 주 증시  빅테크 실적에 쏠린 눈 제한적 반등 기대,Securities
성장통인가 추세하락인가  차전지 올 들어 시총   조 증발,Securities
이차전지  부진에 코스닥 상위   곳  개월간 시총   조 증발,Securities
    반도체 수요 커진다  반도체    수익률 고공행진 펀드와치 ,Securities
 증시캘린더 이번 주  월 주  포스뱅크 이닉스 상장 등,Securities
이차전지 시총   조 증발 전기차 업황 영향,Securities
기업은행  전 업무 전자문서  추진   디지털 전환 박차,Securities
코스닥 시총순위 지각변동      약진,Securities
코스닥 주간 개인 순매도  위  에코프로 ,Securities
코스닥 주간 외국인 순매도  위  제주반도체 ,Securities
코스닥 주간 기관 순매도  위  엘앤에프 ,Securities
코스닥 주간 기관 순매수  위      ,Securities
코스닥 주간 외국인 순매수  위  에코프로 ,Securities
코스닥 주간 개인 순매수  위  현대힘스 ,Securities
코스피 주간 개인 순매도  위  삼성전자 ,Securities
코스피 주간 외국인 순매도  위  삼성    ,Securities
코스피 주간 기관 순매도  위  삼성전자 ,Securities
코스피 주간 기관 순매수  위    화학 ,Securities
코스피 주간 외국인 순매수  위  삼성전자 ,Securities
코스피 주간 개인 순매수  위    하이닉스 ,Securities
실적은 깜짝인데 주가는 꿈쩍않네   실적 포인트 찾기  충당금  투자뉴스 뒤풀이 ,Securities
 삼성    현대 합쳐도 못 이겨  머스크도 혀 내두른 회사  김익환의 컴퍼니워치 ,Securities
 이번 주 코스피 제한적 반등할 듯   빅테크 실적 주목  주간전망 ,Securities
월배당    에 빠진 개미 제 월급통장 되려면  이것  따져야 선데이 머니카페 ,Securities
 주간 증시 전망    연준 금리 인하 기대 하락 코스피          ,Securities
 증시 풍향계  급한 불은 껐지만      빅테크 실적 주목,Securities
 공모주달력 깐깐해진 당국  신고서 고쳐쓴 코셈 케이웨더 수요예측,Securities
 베이징 다이어리 중국판 월급루팡   모위 의 최후,Securities
 이번주      월 첫째 주 수요예측 청약 일정,Securities
 반토막 난 내 주식 살려줘  이제 믿을 건    톱스타  뿐  신현아의    그후 ,Securities
 와 대박  신청도 안했는데 공모주 당첨   따상 꿈  부풀었는데 알고보니 사기,Securities
실적  빨간불  들어온 증권가 바닥일까 아직일까,Securities
 일요일 정상영업  서초구 대형마트  의무휴업일 변경  문 여는 곳 어디 ,Securities
올들어   조 증발 눈물의 이차전지,Securities
   마켓워치 에프앤디넷 매물로,Securities
개미들  올들어  조원 순매수 대부분  손실 ,Securities
 세계  위  비츠로셀 본사 가보니   공매도 전설도 샀다고  윤현주의   이 주식 ,Securities
증시는 원래   동조 아니었어  올해는 왜    동조 로 바뀌었을까요  유혜림의  마카세 ,Securities
올해 첫     서 금리인하 힌트 찾기 환율 방향성 탐색 주간외환전망 ,Securities
한 미 커브 스티프닝   월     의 파월 의장 스탠스 주목 주간채권전망 ,Securities
 뉴욕증시 주간전망   월      고용 실적 주목,Securities
대내외 리스크에 흔들리는 투자자들   안전자산 피난처로 대피,Securities
이차전지 시총  올해 들어   조 증발  추세하락 진행 중 ,Securities
게임사      실적 희비 교차   넥슨  매출  조  향해 독주,Securities
 증시 들어가유  백종원 더본코리아     추진  기업 가치는 얼마,Securities
 터미네이터 는 안돼   인류 위한 로봇 의  사람 역할  중요,Securities
알아서 척척  미래 경제 발전 이끌 폭발적인 잠재력,Securities
대한민국 주식부자  위  삼성  아니었네   세 모녀  사이 비집고 들어간  이 사람   신동윤의 나우 스톡 ,Securities
일상의 인간 역할 대신하는 만능 팔,Securities
개미들 올해 들어  조원대 순매수 상위   개  평균     ,Securities
 비즈    실적 꺾인  맏형    엔솔  삼성      온 전망은,Securities
 정부   초주검 증시  백기사로 나섰다  김규환의 핸디 차이나 ,Securities
 단독      앞둔 이녹스에코엠      억 밸류로 투자유치,Securities
 주간증시전망    하이닉스 깜짝 실적에 누그러진 우려  주요 기업 성적 발표 계속,Securities
평균연봉  억 넘는  대 은행   돈잔치  비판 속 성과급 줄였다,Securities
 차전지 테마 탈 때 주식 팔았던 후성 최대주주      억 유상증자엔 절반만 참여,Securities
 준법 윤리경영  힘주는 한국콜마  공정거래 관리자 신규 선임,Securities
  대 자산가  주식 양도세  시총만 따질 게 아니라고요    세무 재테크     ,Securities
김주현 이복현  내일 입 연다 홍콩     코인     주목,Securities
 시총    억원  썸씽     억원 상당 코인 털렸다  투자 주의보 ,Securities
   인 미만 도 중대재해처벌법 적용 안전관리 필수,Securities
포스코이앤씨  부산 촉진    재개발 수주   오티에르  통했다,Securities
 비트코인     금지령 이 코인거래소엔 호재  이지영의 코인세상 ,Securities
 청기홍기  삼성바이오   현대일렉트릭 깜짝실적에 목표가  ,Securities
 월 넷째 주  마켓    핫종목 주요 이슈  분 완벽정리  위클리 리뷰 ,Securities
실적 신화 써 내려가는 현대차 기아 정의선의 마법 올해도 ,Securities
   만 팔로워  정용진  친절한     홍보  발망 수장 만나 랜더스 유니폼 줬다 ,Securities
 그 가격에 내가 왜 샀을까   따따블  간 공모주  한달 만에 반토막,Securities
 부고 안정진 이베스트투자증권 주식운용본부장 씨 부친상,Securities
 오를 등급은 오른다  등급 상향된 현대코퍼레이션,Securities
카카오픽코마  일본  위 거래액     억엔 넘어,Securities
돌아온 외국인  사실상 삼성전자만  편식 ,Securities
꽁꽁 얼었다더니  날씨 왜 이래        폭락  당황한 개미들,Securities
 투심 주춤  가상자산 거래소 거래량  뚝  달러 연동 코인  반짝 ,Securities
  발 지각변동     시총  위 알파벳  조달러    테슬라 추락,Securities
 불금 밤에 무슨일  신한카드 결제 한때  먹통     시스템 장애 복구,Securities
 담당자가 없다고   해외 부동산  손실인데 관리도 부재,Securities
뉴욕증시  기술주 약세 물가 둔화 속 혼조 마감 인텔     급락,Securities
 부동산   충당금 적립  잇단 당국 경고에 숨가쁜 금융권,Securities
 다음주 증시 전망   실적 발표에 달린 주가   증시 반등은 제한적 ,Securities
 코스피 언제 날아오를까     로 눈 돌리는 서학개미,Securities
서울  전세대란  전망  두산위브더제니스 센트럴 계양    일부터 정당 계약,Securities
   테마 타고 기관  러브콜  올해      급등한  이 종목  종목현미경 ,Securities
 뉴욕증시  기술주 약세에 혼조 마감  인텔      엔디비아    하락,Securities
떨어질 만큼 떨어졌나 비트코인    급등   만    달러 회복,Securities
인공지능 반도체 경쟁서 밀렸다 인텔 급락이 말하는 것  글로벌마켓     ,Securities
 차 협상 결렬 동맹 이탈     품은 하림   산 넘어 산 ,Securities
 저가 매수  비트코인    급등   만    달러 회복 상보 ,Securities
 자사주 매입한다  증권주 주가 웃음꽃  올해 전망은 ,Securities
수백조원 부양책 내놓은    국내 증시  차이나 리스크  끝나나 ,Securities
 속보  비트코인    이상 급등   만    달러 회복,Securities
테슬라       리비안        전기차 루시드 제외 일제  상보 ,Securities
 월에    마이너스 금리  끝  주목되는 이주식,Securities
테슬라   개월 만에 최저가 잠 못 드는 개미,Securities
테슬라       상승했지만 주간 기준으로는     폭락,Securities
스튜디오삼익  공모주 청약 경쟁률      대   증거금  조  뭉칫돈   시그널 ,Securities
인텔     폭락에 필라델피아반도체지수도    급락 종합 ,Securities
   마켓워치 한강에셋  씨티스퀘어 매각 착수,Securities
