titles,category
한국증권금융  이영찬 상무 신규 선임,Securities
우리자산운용 우리글로벌자산운용 통합법인 출범  상품 라인업 확대 ,Securities
비유테크놀러지  셀럽골프앤리조트와     발행 및     서비스 협약,Securities
       시간 실시간 환전 거래 서비스 제공,Securities
이에이트  오늘부터 수요 예측 주요 기관들 참여,Securities
 특징주  포스뱅크  상장 첫날       급등 ,Securities
대신   연   대 우량 채권 온라인 특판 진행,Securities
우리자산운용 통합법인 출범   순자산   조 운용사로,Securities
대원전선  지난해 영업이익    억 전년         ,Securities
진양산업  지난해 영업이익   억 전년        ,Securities
 특징주  엘앤에프  코스피 이전 상장 첫날   대 하락,Securities
  현대중공업      억 규모       척 수주,Securities
더블유씨피  지난해  분기 영업이익   억 전년        ,Securities
 특징주   따따블  현대힘스  상장 이튿날    대 급락,Securities
삼일     올해    시장 회복세 상장 전략은 다변화 필요 ,Securities
주가 추락하자   공모펀드 지난해   조 손실,Securities
 특징주  엘앤에프  코스피 이전상장 첫날  약세 ,Securities
지난해     발행     조 상환액 전년대비     급증,Securities
       차량호출 업체 디디와 맞손 배터리교체 합작사 세웠다,Securities
새해 들어 시가총액   조원 증발한  차전지 주초부터  약세  핫종목 ,Securities
 깜짝실적  크래프톤 장중 강세   주 신고가도,Securities
        하이브    분산투자해볼까   한투운용          포커스     출시  투자    ,Securities
 특징주  삼성바이오로직스   대 강세     중국 바이오 기업 규제 반사이익,Securities
키움   미국주식옵션 거래   종목    종목 확대,Securities
   년 덴마크 전통 스테프핫도그  수제 햄버거 신메뉴 출시,Securities
     간암 치료제     허가 기대감에   대 강세 핫종목 ,Securities
  글로벌  지난해 영업이익   억원 흑자 전환,Securities
 새내기  잘나가네  포스뱅크  코스닥 입성 첫날  따블        상승,Securities
 해외 부동산 손실 우려 크다   감사원  연기금 공제회 대체투자 특별감사 재개,Securities
대원전선  지난해 영업익    억 전년비         ,Securities
  전자 프리미엄 정수 가습기  하이드로타워   판매 호조에 가습기 시장  돌풍 ,Securities
중등 인강 엠베스트   내신 전 과목 만점 및 영재교육원 합격  후기 공개,Securities
대한전선  유상증자  차 발행가액     원 결정,Securities
  팝 확장성에 투자  한투운용          포커스     상장,Securities
  채권왕  닷컴버블 연상돼   증시     폭락 가능성 ,Securities
 게시판  키움증권  미국주식옵션 거래 가능 종목 확대,Securities
   산업 특성  대기업보다 중기 잘 맞아 향후 유의미한 매출기업 중심 구성   투자    ,Securities
진양산업  지난해 영업익   억 전년비        ,Securities
비유테크  셀럽골프앤리조트와     발행 및     서비스 협약,Securities
      년 만기 연 최고           공모,Securities
키움증권  미국주식옵션 기초자산    종목으로 확대 ,Securities
 특징주  첫 미군 사망  중동 불안감 고조에 석유  강세,Securities
 포토  포스뱅크  코스닥시장 상장기념식 개최,Securities
면세 판매 저조 공항 수수료 혜택 소멸 호텔신라 목표주가     하향,Securities
  현대중공업      억 규모       척 수주 계약,Securities
지난해     발행금액   조   억원 전년 대비      줄었다,Securities
비투엔     그룹 글로벌 투자 유치 나선다  본격 반려동물 시장 공략 ,Securities
 특징주 포스뱅크 상장 첫날 따블 달성 후 하락     대 강세,Securities
 특징주 초전도체 테마   일제히 약세,Securities
오킨스전자  세미콘코리아 참가  차세대 메모리 전기차 커넥터 사업 확대 ,Securities
우리자산운용 통합법인 출범  상품 라인업 확대로 경쟁력 강화 ,Securities
우리자산운용 통합법인 출범   순자산     규모 ,Securities
      년 만기     공모  연 최고       수익,Securities
 특징주 디에이테크놀로지  흑연서 상온 초전도체 발견 논문 베트남 흑연 사업 부각 ,Securities
     인도 뭄바이 사무소 설립  투자    ,Securities
금투협   금융투자상품 이해  과정 개설,Securities
       반도체    국내 반도체     중 최대 개인순매수,Securities
공사비 인상에 분양가 급등  실수요자들 알짜 단지 선점에 주목  상도 푸르지오 클라베뉴  분양,Securities
코스피  개인 매수    외인 매도       선 횡보,Securities
상장 둘째날 힘빠진 현대힘스       ,Securities
   랩스                    행사 개최,Securities
  증권   년 만기     이달 말까지 공모,Securities
더블유씨피   분기 영업익   억 전년비        ,Securities
 특징주       신약     승인 기대감 계열사 일제히 강세,Securities
틱톡코리아 레페리  틱톡 뷰티 콘텐츠 크리에이터 활성화 위한     체결,Securities
 특징주   코스닥 시총  위  엘앤에프  코스피 이사 첫날   대 약세,Securities
작년     발행액   조   억   전년       ,Securities
제로투엔 크리에이티브 그라운드  서울시 도시건축 창의 혁신디자인 시범사업 선정,Securities
메가젠임플란트     년 연속 유럽 수출  위 달성 ,Securities
 순자산   조  우리자산운용 통합법인 출범  상품군 확대 집중   투자    ,Securities
 특징주  엘앤에프  코스피 이전 첫날  투심 위축     약세,Securities
코스피  개인 기관 매수에 강보합      대 회복 종합 ,Securities
 특징주  포스뱅크  상장 첫 날     대 강세,Securities
코스피의 매운맛  엘앤에프  코스피 이전 첫날   대 약세  투자    ,Securities
  글로벌  지난해 영업익   억 흑자전환,Securities
      바이오 기업 규제    만 원 회복한 삼바,Securities
코스닥 짐 싼 엘앤에프  이전상장 첫날     주르륵  핫종목 ,Securities
시세조종 수사 경영진 물갈이 에스엠 주가 약세,Securities
  와 협업  씨젠 다시 시동거나 주가     급등,Securities
     인도서 대체투자 기회 찾는다   뭄바이 사무소 설립,Securities
대신증권  연   대 우량 채권 온라인 특판,Securities
한국캐피탈  따뜻한 나눔 실천  사랑의 밥퍼  나눔 봉사,Securities
 특징주  포스뱅크  코스닥 상장 첫날  강세 ,Securities
   실적      앞두고 눈치보기   코스피 코스닥 엇갈린 등락,Securities
모던라이언  장범준 콘서트     티켓 단독 판매  암표 근절 나선다 ,Securities
    반도체  비중에 갈린 개인 투심        미국반도체    순매수  위,Securities
  대 기획사에     투자         에 진심인     등장,Securities
 특징주 크래프톤      어닝 서프 에   주 신고가,Securities
비유테크놀러지  셀럽골프앤리조트와     발행 및     서비스 협약,Securities
 코스닥 새내기  포스뱅크  상장 첫 날     대 강세,Securities
리서치알음  오로라  글로벌 캐릭터 콘텐츠전문기업으로 변모중   상승여력       ,Securities
대신   연   대 우량 채권 온라인 특판,Securities
     앞두고 증시 혼조세 코스피 상승 코스닥 약보합 개장시황 ,Securities
신저가 딛고 반등하나    엔솔  어려울수록 투자   이슈 전략 ,Securities
포스뱅크 코스닥시장 상장기념식,Securities
지난해     발행액     조원 하나증권 발행규모  위,Securities
코스피  장 초반 상승세     선 탈환 시도,Securities
 특징주  해운 정유   중동 긴장 속 미군 사망자 발생에 상승,Securities
       엔솔  수요 부진 여파 예상보다 커 목표가  ,Securities
 특징주  포스뱅크  상장일     대 상승  따따블 은 글쎄,Securities
 주 포스뱅크 코스닥시장 상장기념식,Securities
  증권    시간 실시간 환전 거래 서비스 제공,Securities
국고채  일제히 약세 출발    년 국채선물    틱대 하락,Securities
유진투자선물  해외선물 실전투자대회  커뮤니티 리그 시즌    개최,Securities
      년 만기     공모,Securities
  현대  머스크와  그린오션  새 시대 연다,Securities
 현대모비스  전동화 전장부품 투자회수 지연  목표가 ,Securities
       시간 실시간 환전 거래 서비스 제공,Securities
태영건설우  상한가 태영건설  미지급 공사대금 지급키로,Securities
 특징주 엘앤에프  코스피 이전 첫날   대 약세,Securities
강보합세로 출발한 코스피,Securities
코스피 초반 보합세,Securities
강보합세로 출발한 코스피,Securities
포스뱅크  코스닥 상장 첫날  따블      대 상승세  증시이슈 ,Securities
강보합세로 출발한 코스피,Securities
강보합세로 출발한 코스피,Securities
중동서 미군 사상자   명 발생 소식에 국제유가      ,Securities
코스피 장 초반에,Securities
코스피 보합세로 출발,Securities
코스피 보합세로 출발,Securities
코스피 보합세로 출발,Securities
코스피 보합세로 출발,Securities
프로티아  지난해 해외   개국 신규 진출 수출 규모 확대 기대,Securities
하이투자증권   하이 마이트리     랩  판매,Securities
몰테일  애플 비전프로 사전 판매에 맞춤 배송서비스 제공,Securities
         너무 올랐나    엔솔   분기 영업적자 전망  주가는    강세,Securities
  증권    시간 실시간 환전 거래 서비스 제공,Securities
소프트뱅크벤처스      로 사명 바꾼다,Securities
  모간의 경고    테슬라 연말까지     폭락 ,Securities
삼성운용        미국반도체    개인투자자 올해    억 최대 순매수 ,Securities
 특징주   배틀그라운드  크래프톤  호실적 발표에 연고점 경신,Securities
 특징주  포스뱅크  코스닥 상장 첫날  따블  성공,Securities
 영업익       급증  경동나비엔  주가도 날았다,Securities
대신증권  연   대 우량 채권 온라인 특판 각    억 한도,Securities
 국힘 잔류  총선 불출마 선언한 유승민 테마주 급락,Securities
오늘 증시 개장 시황은 ,Securities
오늘 증시 개장 시황은 ,Securities
원 달러 환율 상승 출발,Securities
상승 출발한 코스피 환율,Securities
코스피 환율 상승 개장,Securities
 특징주  크래프톤  호실적 발표에   주 최고가,Securities
코스피 상승 개장,Securities
오름세 보이는 코스피 환율,Securities
코스피 상승 출발,Securities
지난해     총 발행금액   조   억원 전년비      ,Securities
 따따블  성공했던 현대힘스  상장 이튿날엔    ,Securities
정철동   디플 사장       대세 속 협력사와 원팀 강화 ,Securities
빗썸  수수료 무료  중단 임박 업비트보다 낮추나,Securities
 특징주  삼성바이오로직스    우시바이오 규제 이슈에 강세,Securities
 증시   다우 영향으로 상승 출발 닛케이지수       ,Securities
긴장감 고조되는 중동 석유주 장 초반 강세,Securities
캐리어에어컨  중대형    인버터 에어컨 냉난방기 출시,Securities
비전프로로 뜨거워진     연초대비     급등 ,Securities
 따따블  찍고 하한가 급락    첫 날 팔아라  ,Securities
  증권  최고 연       수익  년만기     공모,Securities
대신   세전수익률 연   대 우량 채권 온라인 특판,Securities
 특징주  엘앤에프  코스피 이전 상장 첫날 약세,Securities
   마켓워치 매쉬업엔젤스  글로벌 로컬라이제이션 마케팅      개발에 투자,Securities
 미국     허가 임박      계열사 일제히 강세,Securities
코스피  개인 매수세에 상승      선 회복,Securities
 보조금 제외하면  분기도 적자    엔솔 강보합,Securities
하이투자       활용  하이 마이트리     랩 판매,Securities
 특징주 바이오산업까지 넓어진 미중전선 삼바  반사이익 기대에   대 ,Securities
   로     뉴진스 효과 누린다 한투운용       포커스 상품 출시,Securities
중국  공매도 제한  일정 기간 제한된 주식대여 전면 금지 ,Securities
 지금 당장 매수  어닝 서프라이즈에 주가  쑥 ,Securities
   부터    까지 회사채 연초 효과 지속되나,Securities
 특징주  원익     테라 퀀텀 흑연서 상온 초전도체 발견  계열사 제품 생산 판매 부각,Securities
  증권   년 만기 원금지급형 홍콩 지수     공모,Securities
하이투자증권     에 투자하는  하이 마이트리     랩  판매,Securities
유럽 조기 금리인하 기대에  강달러  환율  장중     원 턱 밑,Securities
 특징주 태영건설  이달 중 협력업체 공사대금    억 지급 소식에 강세,Securities
 너희한테는  원도 안 맡겨  여의도 라이벌의  실적 전쟁 ,Securities
원 달러 환율  장 초반 상승      원대 후반,Securities
현대차증권   월 코스피             ,Securities
       시간 실시간 환전 거래 서비스 제공,Securities
 특징주 엘앤에프  코스피 이전 첫날   대 하락 출발,Securities
한국캐피탈   사랑의 밥퍼  나눔 봉사 실시,Securities
소프트뱅크벤처스      로 사명 교체,Securities
포스뱅크  코스닥 입성 첫날  따블  달성 핫종목 ,Securities
비유테크놀러지  셀럽골프앤리조트와     발행     서비스 협약,Securities
 추가 상승 기대감  비트코인      만원 돌파 시도,Securities
하이   국내     활용  마이트리     랩  판매,Securities
 특징주  크래프톤   깜짝실적 에 강세 장 초반   주 신고가,Securities
하이투자증권   하이 마이트리     랩  판매,Securities
 고마진 차량   현대오토에버 목표주가   만원    ,Securities
우리운용  통합법인 출범 순자산   조원,Securities
상장 첫날  따따블  성공한 현대힘스  이튿날     급락 핫종목 ,Securities
 특징주 현대힘스  따따블 이후    대 급락,Securities
엘앤에프  코스피 이전상장 첫날  하락  시총   위로 입성,Securities
코스피  관망 심리 유입 속 상승 출발 삼바   대  ,Securities
   마켓워치 소프트뱅크벤처스           억 투자,Securities
 글로벌 색조 시장 잡는다  코스맥스  생산력 확 늘린다,Securities
    올린 에스원  투자의견  중립    매수  이베스트,Securities
       시간 실시간 환전 거래 서비스 제공,Securities
패션그룹형지  지난해 영업이익    억원      증가,Securities
 특징주      신약 기대감에   주 신고가  만원대 목전,Securities
포스뱅크  오버행 우려 딛고 상장 첫날      질주,Securities
휴젤  태국서    필러 론칭  현지 의료진 대상 세미나 성료,Securities
포스뱅크  코스닥 상장 첫날     대 급등 핫스탁 ,Securities
포스뱅크  코스닥 상장 첫날       급등 ,Securities
미국 최대 커뮤니티 레딧      앞두고 가치 하락에 고심,Securities
  증권    시간 실시간 환전 거래 서비스 제공,Securities
유진투자선물  해외선물 실전투자대회 개최,Securities
코스피 이전 상장에도 약세  펀더멘탈 유의미 변화 필요 ,Securities
설 명절 앞두고  바나나 등 수입과일 값 내려   할당관세 효과 톡톡,Securities
코스피  상승 출발하며     선 회복 환율      원 후반대로,Securities
코스닥  외국인 기관  팔자  약보합 출발,Securities
우리자산운용 통합법인 출범  라인업 확대  경쟁력 강화 ,Securities
코스피  장초반       상승        선 코스닥         보 ,Securities
비씨엔씨  반도체용 폴리 실리콘 소재 부품사업 본격 진출,Securities
코스피             포인트  오른         출발,Securities
코스피로 옮겼는데 엘앤에프 이전상장 첫날 주가 보합권,Securities
코스피  장 초반 강보합 코스닥은 소폭 하락,Securities
 특징주  포스뱅크  코스닥 상장 첫날  따블  달성,Securities
포스뱅크  코스닥 상장 첫날      급등 특징주 ,Securities
코스닥       오른        출발        ,Securities
코스피        오른         출발         ,Securities
 코스닥 개장       포인트        오른        출발,Securities
코스닥     포인트        오른        출발,Securities
 코스피                오른         출발,Securities
 나를 따르라    주주환원 늘리는 증권사  이슈 전략 ,Securities
코스피                  코스닥                 원 달러 환율       원     원  개장 시황 ,Securities
 코스피 개장        포인트        오른         출발,Securities
코스피      포인트        오른         출발,Securities
 코스닥               오른        출발,Securities
 달러 원  환율    원 오른       원 출발,Securities
원 달러 환율    원 오른       원 출발,Securities
 속보 코스피          출발        ,Securities
유진         이후  월 금리인하 기대 소멸  월로 시선 이동 ,Securities
 스팟 코스닥               오른        출발,Securities
 스팟 코스피                오른         출발,Securities
한투운용  엔터  사 집중 투자      포커스      상장,Securities
증권가   실적부진  호텔신라 목표주가 줄하향,Securities
 현대모비스  올해 외형 성장은 어렵지만 수익성은 개선될 것 ,Securities
삼성   호텔신라  단체 관광객 수요 회복 더뎌 목표가  만  만 ,Securities
예비     코셈  글로벌 시장 점유율 확대 전망  유진,Securities
  증권  현대모비스 목표가 하향    전동화 사업 흑자전환 지연 ,Securities
하이투자증권   하이 마이트리     랩  판매,Securities
애경산업     기대치 하회에도 우려 없다 목표가  만 상상인,Securities
   하이닉스  실적 서프라이즈에도 주가 변동성 커져  미래에셋증권,Securities
   엔솔  수요부진 여파 예상보다 커 ,Securities
유안타   현대모비스  시장 기대치 밑도는  분기 실적  모듈 부품 사업 수익성 정체 ,Securities
신한   호텔신라  실적 부진에 목표가 하향    여행객  분기   ,Securities
 클릭  종목  호텔신라  해외  임차료 감면 혜택 축소 목표가   ,Securities
   투자증권    이노텍  실적 모멘텀 부재 목표가     하향 ,Securities
 내수 한계  올해 게임업계 화두는  글로벌 공략 ,Securities
하나증권    엔솔  보조금 제외시 영업적자 불가피 목표가       하향 ,Securities
           원       원     원 상승,Securities
미 전력망 수주  지난해만큼 늘기 힘들어     일렉트릭 목표가   하이,Securities
 돈나무  캐시우드  테슬라 폭락하자    억원  줍줍 ,Securities
프로티아  지난해 알레르기 진단 제품으로   개 국가 진출,Securities
     시총  천억달러 돌파  테슬라 제치고  매그니피션트 세븐 ,Securities
 오늘 상장  포스 키오스크  기업 포스뱅크  코스닥 입성,Securities
상속세 개편  다른나라들은 싱가포르    의 유혹  그래도 필요하다 는 일본  신인규의 이슈레이더 ,Securities
   마켓워치 뉴패러다임인베  올    억 투자,Securities
 국내외 주요 기업 실적 시즌   증시  변동성 국면 ,Securities
비씨엔씨  반도체용 폴리 실리콘 소재 부품사업 진출,Securities
삼일     올해     시장 회복세 상장전략 다변화해야 ,Securities
 현대오토에버      비용 반영돼 실적 부진 투자의견  중립   삼성,Securities
 월 대기업 회사채   조 육박  최대 호황 ,Securities
루닛     유방암 검진  루닛 인사이트        판매 개시,Securities
      현대차  글로벌 판매 둔화와 불확실성 목표가   만원으로 하향 ,Securities
 애플 앱스토어 수수료 인하에도 국내 게임주 꿈쩍않는 이유는  다올,Securities
달러 강세 속 리스크 오프 환율     원 후반대 복귀 외환브리핑 ,Securities
호텔신라  중국인 단체 관광 회복까지 기다려야   ,Securities
디앤디파마텍   합작사 지알파  알파 방사선 전립선암 치료제 미국 특허,Securities
 환율 걱정 말고 면세 쇼핑하세요 롯데면세점  설맞이 이벤트,Securities
 블루라이트까지 차단   설화수  상백 선케어 라인 출시,Securities
 굿모닝 증시  혼조마감 국내 우호적 환경 코스피 강보합 전망,Securities
한투운용  엔터 사 집중 투자          포커스      상장,Securities
      전환사채 채권자와 채무조정 합의,Securities
  조   악템라 시장 열렸다   셀트리온 품목허가 도전,Securities
미래   애경산업  해외 매출   집중  목표가 하향 ,Securities
   하이브        비중만              포커스      상장,Securities
   마켓워치 퓨처플레이     게이밍 솔루션에 투자,Securities
대신증권  호텔신라 목표가   보릿고개 지나는 중 ,Securities
한투운용  엔터주 집중하는          포커스     ,Securities
   조원 대규모   년물 입찰  장 마감 후   재무부 리펀딩 채권브리핑 ,Securities
삼성증권  현대모비스 목표가 하향  전장부품 투자회수 지연 ,Securities
코아시아  인도 반도체 산업 육성  현지 팹리스 지원 협회      업무 협약 ,Securities
삼성   호텔신라    관광객 수요 둔화로 실적 부진 목표가      ,Securities
삼성   현대오토에버  수익성 기대치 하회  투자의견 하향,Securities
한화오션 부진 탈출 돈 버는 회사로 거듭나는 원년 한국투자증권,Securities
하이투자  한화  풍력발전 디벨로버로 성장 기반 마련 중 목표가  ,Securities
 미국 경제     년대와 유사한 흐름  승자독식  하이,Securities
 클릭  종목  오로라  글로벌 캐릭터 콘텐츠 업체로 성장 ,Securities
호텔신라  주가는 연중 최저점 수준이지만 반등 모멘텀  풍부 ,Securities
웹젠   뮤모나크 로 실적 선방 신작 흥행시 재평가 신한,Securities
컴투스  성장 가능성 증명할 시점 신한,Securities
여행업 회복에 상품 구성 비즈니스 모델 확대 시너지    노랑풍선 기대 ,Securities
   이노텍  실적 우려 선반영됐지만 모멘텀 안 보여  목표가  ,Securities
 네오위즈    의 거짓 에도  분기 영업익 예상치 하회  목표가  ,Securities
하나   리파인  저출산 정책 대환대출 수혜주 ,Securities
메가젠임플란트    년 연속 유럽 수출  위 역대 최다 기록 경신 ,Securities
엘앤에프  코스피 거래 첫날  주가 상승 효과 제한 ,Securities
애경산업  체질 개선 안정적인 실적 성장 전망 한화,Securities
 뉴스새벽배송 랠리하던 뉴욕증시 숨고르기 인텔     ,Securities
미리보는 주총 이슈  지배구조 경영권 분쟁 배당정책 주목 ,Securities
   마켓워치 더인벤션랩 그라운드업벤처스  인증 리퍼비시 플랫폼에 베팅,Securities
    한국직업개발원  최두원 관세사      강의 신규 출시,Securities
  부자 가문  위 삼성   아시아에선 몇등  작년보다  위 하락했다는데  투자    ,Securities
 반도체 배터리뿐 아니다  소비재 화학 등 전방위 어닝쇼크  이익 전망치   조   조  뚝 ,Securities
 보다도 더 떨어진 국내증시 이번주     가 두렵다   투자    ,Securities
 클릭  종목        첫거래  엘엔에프  지수편입 효과  글쎄 ,Securities
 엘앤에프  코스피 이전 첫날 주가 상승  반짝효과  그칠듯  메리츠,Securities
 코스닥  코스피 대비 선방  월도 중소형  대응 유효 ,Securities
 클릭  종목  한화오션   분기엔 적자 올해 영업익 수주 회복 기대 ,Securities
올트먼  오픈   와   반도체  결국 손잡나  기로에 선 테슬라와    차전지 앞날은   한상춘의 지금세계는 ,Securities
  엔솔  향후    라인업에서 안정적 매출 성장 기대    ,Securities
에쓰오일  낮아진 주주환원 여력 목표가  하향  현대차,Securities
 클릭  종목  현대모비스  단기 주가 반등 모멘텀 부재 목표가  ,Securities
 클릭  종목  리파인  저출산 정책과 대환대출 수혜주 ,Securities
   마켓워치 우리자산운용 통합법인 출범  순자산    ,Securities
 오늘 코스피 상승 출발      따따블 주목,Securities
엘앤에프 오늘   일  코스피 상장  유의미한 주가 상승 부정적  메리츠,Securities
 클릭  종목  에스원  배당금 상향 긍정적 목표가  ,Securities
 에스원  주주가치 제고 긍정적 투자의견 목표가   이베스트,Securities
   통화정책 수정 임박 증시 상승세 제한 ,Securities
현대모비스   분기 실적 예상치 하회 수익성 정체 장기화 유안타,Securities
에스원  안정적인 실적 대비 주가는 저평가 목표주가  만원   ,Securities
 클릭  종목    엔솔  전기차 수요 둔화 지속 목표가   ,Securities
 목사  하나님 계시 라며 신도에 가상화폐 팔아   억원 가로채,Securities
 동양 사태  피해자들  천억대 집단소송  심도 패소,Securities
