titles,category
 옆 부서 동기는 연봉      나는  원  삼성전자 성과급 극과극 종합 ,Industry
두산에너빌리티  태국에      공급 추진,Industry
  현대   힘센엔진       대 생산 세계 시장  위,Industry
금호석화 작년 영업익  천   억원          수요 약세 지속  종합 ,Industry
설 앞두고 분주한 청과시장,Industry
설 앞두고 분주한 농산물도매시장,Industry
설 대목 맞은 농산물도매시장,Industry
설 대목 맞은 청과시장,Industry
설 앞두고 북적이는 청과시장,Industry
분주한 농산물도매시장,Industry
설 앞두고 분주한 농산물도매시장,Industry
분주한 농산물도매시장,Industry
설 대목 맞은 청과시장,Industry
설 앞두고 분주한 농산물도매시장,Industry
  바이오팜  세노바메이트 고속성장 지난해    영업이익  흑자전환 ,Industry
설 앞두고 분주한 농산물도매시장,Industry
낸드도 봄날 오나    웨스턴디지털  낸드 재고  년만 최저 ,Industry
설 앞두고 북적이는 청과시장,Industry
대상  지난해 영업익      소재부문 부진,Industry
 성과급 반토막    엔솔  성과급          축소된 이유,Industry
설 앞두고 분주한 청과시장,Industry
설 앞두고 분주한 농산물도매시장,Industry
 대통령도 통신비 내려달라 했잖아요      지원금 늘리나 그럼 미리 산 사람은 어떡해 ,Industry
 비상경영에 허리띠 졸라매지만  삼성  작년  역대급    로비 지출,Industry
 진짜     할인해준다고   아웃렛보다 싸다는  이곳  어디길래,Industry
부산시의회  수산식품산업 육성 조례안  원안 가결,Industry
한전      년까지  전봇대 무단 설치  통신선  만  정비,Industry
아임토리           피닉스컨택트 솔루션 파트너 인증 획득,Industry
         아름다운 갤럭시   삼성 성과급도 아름다웠다,Industry
대기업들 설명절 내수활성화  팔  걷었다,Industry
쿠팡이츠  연초  와우할인  뱃지 회수 경고 외식업주 관리 강화,Industry
 집사 되니 간질간질  고양이 털 알레르기  개 털의  배 왜 ,Industry
  전시회  무알코올 주류  난치성 염증치료  글로벌 진출이 목표 ,Industry
    설 명절 앞두고 협력사에 납품대금 미리 지급  상생협력 강화 ,Industry
에쓰오일  바이오 순환 원료 기반  저탄소 친환경 제품  생산,Industry
삼성전자 성과급 희비 모바일은 연봉      반도체   ,Industry
환경부 차관도 포스코퓨처엠 포항 음극재 공장 방문,Industry
 반성 중  선처 호소하더니 또 반도체 기술 중국에 빼돌린 회사,Industry
 전기차 배터리 자원순환 클러스터  예정부지 방문한 임상준 차관,Industry
  벡셀  첫 전기차부품 계약 현대트랜시스에   억원규모 공급,Industry
전기차 험난한 한해 잇따르는 생산 인력 감축,Industry
 단독  한국석유화학협회  협회명서  석유  뺀다 이유는 ,Industry
방통위      자문단 출범 청년 관점서 방송통신 정책 제언,Industry
  엔솔  전기차 수요 성장 둔화에 성과급          ,Industry
삼성전자 반도체 성과급    실적 이끈 모바일    ,Industry
펄어비스  검은사막  대만 게임쇼서   게임 부문 우수상 수상,Industry
  출시 갤럭시    에 바이두 챗봇 탑재 ,Industry
에쓰오일  바이오 순환 원료 기반  저탄소 친환경 제품  생산,Industry
씨엔알리서치  성균관대 약대와 임상시험 플랫폼 개발 협약,Industry
두산에너빌리티  태국에  무탄소 발전 기술  공급한다,Industry
정부의  덜컥  규제에   기업들  아직 기술 없는데 어떻게 하나 ,Industry
국내 유일 에탄올 생산  한국 알콜  노조 운송 거부에    억이상 손해 ,Industry
부산신항 배후단지 입주업체  중처법 확대 적용에 대책 마련 분주,Industry
  현대중공업  독자 기술  힘센엔진   만    대 생산 신기록,Industry
인공지능 마스크로  실시간  감정인식 기술 개발     디지털 컨시어지 구현 기대 ,Industry
금호석화  지난해 영업익     억원 전년        ,Industry
       실시간 감정 인식 기술 개발 맞춤형 서비스도 가능 ,Industry
수익성 저조 네이버 웹툰 자회사 왓패드  직원 추가 해고,Industry
 전동화 바람 제대로 탔다    현대모비스  지난해 해외 수주 사상 최대,Industry
포스코퓨처엠  인프라 규제 개선 정부 지원 필요해 ,Industry
 재활전문동물병원에서 실습  재활테크니션        수업 열린다,Industry
        강원지역협력단  중대재해 예방 안전문화 확산 결의대회,Industry
달라진 포항제철소 출입문 혼잡 줄고 직원편의 확대,Industry
 단독   탄소감축  발등에 불 떨어진 정부  석탄     전환 제동  왜 ,Industry
 금지된 그물 로 제주 해상서 싹쓸이 조업한 중국어선 나포,Industry
업무계획 공유 실시간 피드백 외국계 장벽 넘는  토종      ,Industry
  현대   독자 기술  힘센엔진  생산  만    대 달성,Industry
  현대중공업  자체 개발  힘센엔진     만대 생산 달성,Industry
금호석화  작년  분기 영업익    억원  전년          ,Industry
두산에너빌리티  태국에  무탄소 발전기술  공급,Industry
삼성전자   시장 겨냥 중국판  갤    에 바이두    탑재,Industry
금호석화  지난해 영업익     억원 전년대비       ,Industry
블랙록             억 달러     현물     최초,Industry
세종문화관광재단 대표 공모에   명 지원 내달 중순 임명,Industry
  에코플랜트   찬반 논란  사천 이차전지 단지 투자의향서 제출,Industry
      대에서 간편결제  네카토  약진 삼성페이 전연령 골고루,Industry
 롯데가 배도 만들었다  새롭게  이롭게  우리도 바다 미래 지켜야죠   그 회사 어때  ,Industry
대구시  자체 블록체인 메인넷 구축  관련 산업 육성 ,Industry
철도공단  안산역에 일곱번째    스타트업라운지  개소,Industry
    백신  서바릭스  최적 접종 나이는 ,Industry
제일건설  첨단 제일풍경채 파크원   월 분양,Industry
인천공항 경기도 구간 심야 공항버스 운행 확대,Industry
금호석화  작년 영업이익     억원 전년        감소,Industry
고성군  법무부 지역특화형 비자사업  개 업종 선정,Industry
삼성     러 가전공장 매각 대신 임대 나서는 이유는,Industry
유사나  프로농구 수원   소닉붐과  유사나 브랜드데이  성황리 개최,Industry
철강 조선 해운업간 친환경 자원순환 생태계 주목,Industry
정용진  파리 뉴욕 해외 출장길서 잇단  패션 셀럽  회동 왜 ,Industry
프로레슬링 중계에  조원     는 왜 스포츠에 눈독 들일까,Industry
 속보 금호석유화학  지난해  분기 영업익    억   전년 동기         ,Industry
금호석유화학  지난해 영업익     억 전년        ,Industry
금호석화  작년 영업익     억원 전년 대비        ,Industry
    그룹주 연일 상승  월 간암 치료제     허가 분수령      바이오 ,Industry
현대로템      에 전동차 공급계약      억원 규모,Industry
  조 기부왕 창업주  삼영산업  해고직원 퇴직금   일까지 지급 ,Industry
금호석유화학 지난해 영업익     억     감소  보 ,Industry
첨단 계측 솔루션 기업 노바   세미콘 코리아       참가,Industry
한경협  한시적 규제유예 과제   건 국조실에 건의,Industry
금호석유화학  작년  분기 영업익    억   전년      ,Industry
 실적 부진  삼성전자  성과급 희비 모바일     반도체   ,Industry
    설 협력사 납품대금  조     억원 조기 지급,Industry
두산에너빌리티  태국에  무탄소 발전 기술  공급 추진,Industry
 교육실습  엘리스그룹  시리즈  유치  해외 시장 확장 ,Industry
늦은 추위가 무섭다더니 겨울 한달 남기고 발열내의 불티,Industry
삼성전자 내 성과급 희비 반도체   원     모바일  연봉      종합 ,Industry
서해해경청  설 전후 먹거리 안전 특별점검반 가동,Industry
 쿠팡이 여기까지 온다고   강원도 산골짜기도  쿠세권 ,Industry
  현대   독자개발  힘센엔진   만    대 생산 달성,Industry
 그래픽   인당 쌀 소비량   년째  가공용은       증가,Industry
 월부터  인천공항 남양주 용인  심야 공항버스  개 노선 신설,Industry
한화오션  친환경 해운업 진출  시기  방안은 미정 ,Industry
  현대   국내 첫 독자 기술  힘센엔진  누적  만 천대 생산,Industry
한전      공공기관 최초  공정위 협약이행평가  우수  등급 획득,Industry
 속보 금호석유화학  지난해 영업익     억   전년         ,Industry
  현대중공업  독자 개발  힘센엔진   만    대 생산 달성,Industry
손경식 경총 회장  국회 노사관계 타협문화 없어 중대재해법 확대시행 무리 ,Industry
법원  도로공사 시설관리 위탁업체 직원  파견근로자 아냐 ,Industry
독점    보호  열연강판 반덤핑 추진에 철강업계  시끌 ,Industry
반도체      모바일은  연봉      삼성전자 연말 성과급 희비,Industry
카이투스   무인비행선  기술 알테로스와 독점계약   조 비행선 시장 진출,Industry
동생 구속되자 이번엔 형이  중국에 또 반도체 기술 유출 ,Industry
삼전에선  성과급  이야기 못 꺼내겠네 연봉의           희비,Industry
지아이 프로젠 에스엘  전립선암 치료 면역항암제     백신 병용 추진,Industry
고공행진하는 분양가      당     만원 대 분양 단지는 ,Industry
 쇼핑 온 김에 시승까지  르노      성지  스타필드 수원 접수,Industry
금감원  부실 자산운용사 투자자문사   곳 퇴출,Industry
  현대중공업  힘센엔진   만    대 생산 달성,Industry
   비비고  설 앞두고 고등어구이 가격       인하 하는 까닭,Industry
 의류 세탁 보관을 한 번에  세탁특공대  서비스 론칭 중기소식 ,Industry
오스템파마  구강세정기  와픽   라이브쇼핑  차 연속 매진 ,Industry
뿔난 남양유업 소액주주들  대법원 무시하는 홍 회장  주주 배려해야 ,Industry
철도공단  안산역     스타트업 라운지  연다  번째 무료 지원시설,Industry
  여행 필수코스  돈키호테에   편의점 라면 뜬다,Industry
    등 분산에너지 업체에    억원 매칭 지원 비즈니스 모델 발굴,Industry
현대로템       전동차 공급  년여간     억원 규모 물량,Industry
 특징주 삼성바이오로직스    대 강세     중국기업 규제 영향 ,Industry
손경식  정치권 타협문화 부족 처벌만으로 중대재해 못 막아 ,Industry
 온실가스 줄여라  시멘트업계  탄소중립 기술혁신 고도화 앞장,Industry
올해 무탄소에너지 인증제도 마련    해외기업  참여는 숙제,Industry
 인사  마이데일리,Industry
위메이드  타이베이 게임쇼     로 게임  종 글로벌 정조준,Industry
소프트뱅크벤처스      로 사명 변경,Industry
운동화 선물받은 베컴   꽃미소 ,Industry
팬들과 만난 베컴,Industry
운동화 선물받은 베컴   꽃미소 ,Industry
한국 찾은 베컴   팬들 보고싶었어요 ,Industry
한국 찾은 베컴   팬들 보고싶었어요 ,Industry
한국 찾은 베컴   빠져드는 눈빛 ,Industry
한국 찾은 베컴   팬들 보고싶었어요 ,Industry
팬들과 만난 베컴,Industry
두산에너빌  태국전력청과  무탄소 발전  포괄적 협력관계 구축,Industry
한국 찾은 베컴   팬들 보고싶었어요 ,Industry
한국 찾은 베컴   팬들 보고싶었어요 ,Industry
한국 찾은 베컴   팬들 보고싶었어요 ,Industry
팬들과 만난 베컴,Industry
명품 플랫폼 발란  작년  분기 영업이익 첫 흑자 창립  년만 ,Industry
한국 팬들 만난 베컴,Industry
 공공임대 전세대출 위해 최초계약 때부터 증액보증금 적용해야 ,Industry
환경부 차관도 포스코퓨처엠  인조흑연 음극재  공장 찾았다,Industry
팬들과 만난 베컴,Industry
블룸버그  이재용  재산 약   조    억 원   세계    위 부자 ,Industry
삼성 현대차    등  설 앞두고 협력사 대금 조기 지급 ,Industry
  현대중공업   힘센엔진   만    대 생산 신기록,Industry
개인정보위  구글 넷플릭스에  개인정보 보호  당부,Industry
수원시  새해 첫  희망일터 구인 구직의 날    일 시청서,Industry
  현대중공업  힘센엔진    만    대 생산 기록 세웠다,Industry
설맞아 협력사에 대금 조기지급 잇따라 삼성 현대차       조,Industry
중부고속   청주 강서  하이패스 나들목 이달   일 개통,Industry
물리적 버튼 없앴다 디스커버리 스포츠 부분변경 출시,Industry
삼성 현대차        조 협력사 납품대금 조기 지급한다 종합 ,Industry
한국공항공사   야놀자 와 공항멤버십 도입 시범서비스,Industry
렉시스넥시스 케이스노트 전략적 파트너십 체결,Industry
삼성전자 내 성과급  극과극  모바일  연봉    ,Industry
올해 무탄소에너지 인증제도 마련   연합  포괄적 접근 필요  종합 ,Industry
    설연휴 앞두고 협력사 납품대금     조 조기 지급,Industry
창립   주년 맞는  국립정신건강센터 ,Industry
 설립  주년  제주항공 자회사      누적   만 편 지상조업,Industry
예비 창업자 및 창업  년 이내 기업에 사업자금 쏜다,Industry
중부고속도로 청주강서 하이패스 나들목   일 개통,Industry
  현대    힘센엔진  누적생산  만    대 돌파,Industry
 미국 최대 인터넷 커뮤니티  레딧  상장 앞두고 기업가치 반토막,Industry
한국 시장 공들이는    최고전략책임자 신설,Industry
중흥그룹  설 전에 협력업체 공사대금  천   억원 조기 지급,Industry
 상생  나선 삼성 현대차     설 명절 협력사 납품대금 조기 지급,Industry
           보통작업용 경량안전화          판매 호조,Industry
차량 제작에 노선 운영도 직접  현대로템  철도사업 확장,Industry
중진공  광양에 전남연수원 건립 착수,Industry
펄어비스 검은사막  타이페이 게임쇼  게임 스타 어워드  우수상 수상,Industry
교통안전공단  전기차검사 플러스자격 시범 운영,Industry
약효 없는 것 같은데 안약 건너뛸까  시력 도둑 키운다,Industry
 중처법 시행  타협 부족 원인 노동개혁에 정책역량 집중을 ,Industry
두산에너빌리티  태국전력청과  무탄소 발전기술  협력 맞손,Industry
중흥그룹  협력업체에 공사비     억 원 명절 전 현금지급,Industry
  바이오팜  분기 영업익 흑자전환   올해 흑자기조 목표 ,Industry
두산에너빌리티  태국에 무탄소 발전기술 공급 추진,Industry
한전   월부터  전신주 무단 설치  통신선 일제 정비,Industry
지난해 수도권 분양가      당     만원       상승,Industry
손경식 회장  중대재해법 확대 무리 처벌 능사 아냐 ,Industry
  바이오팜  지난해 영업손실    억원  분기는 흑자 전환,Industry
김준형 포스코퓨처엠 사장  공공 폐수처리 등 환경 지원 요청 ,Industry
롯데   맞춤형 혜택 강화로 내국인 구매 부담 줄인다,Industry
  엔솔  성과급 대폭 줄었다  전기차 둔화 여파 에            ,Industry
부산시  새해 첫 확대간부회의 글로벌 허브도시 실현 논의,Industry
 탈원전은 옛말    원전 확대에     등 동참 의사,Industry
손경식 경총 회장  중대재해법은 예방에 초점 맞춰야 ,Industry
공룡 플랫폼 싹 자르는  플랫폼 경쟁촉진법     창업자 절반 이상  부정적 ,Industry
두산에너빌리티  태국전력청과 무탄소 발전 공동연구,Industry
 럭셔리카  한국에 공들이만 했네 벤틀리 역대 최다 판매,Industry
 실적 좋아도 고민  현대차 기아 노조  특별성과급  요구 드세,Industry
한미     와 통합으로 채무 조기상환 부광과 시너지 기대 ,Industry
한국 찾은 베컴  팬들 만나러 왔어요,Industry
베컴  한국 팬들 만나러 왔어요,Industry
한국 찾은 베컴  팬들 만나러 왔어요,Industry
한국 찾은 베컴  팬들 만나러 왔어요,Industry
한국 찾은 베컴   빠져드는 눈빛 ,Industry
한국 찾은 베컴   빠져드는 눈빛 ,Industry
한국 찾은 베컴,Industry
베컴  한국 팬들 만나러 왔어요,Industry
한국 찾은 베컴,Industry
삼성전자 내 성과급 희비 반도체   원     모바일  연봉     ,Industry
 전략작물직불금 신청하세요  양평군  월  일까지 접수,Industry
현대차  울산공장 끼임 사고  현장조사  재발 방지 최선 ,Industry
 경쟁력 잃어가는 강원랜드   개혁 과제 도출  특별  가동,Industry
  현대   독자 개발  힘센엔진   만    대 생산 신기록,Industry
두산에너빌리티  태국에 무탄소 발전 기술 공급 추진,Industry
펄어비스 검은사막  타이페이 게임쇼  게임 스타 어워드  우수상 수상,Industry
제주항공 지상조업 자회사     설립  주년      만 천여편 조업 ,Industry
소공연  법제처와 소상공인 경제활동 저해 규제개선  맞손 ,Industry
꼬마빌딩 신축건물 공실 소유자  스터디카페  작심  창업 주목,Industry
펄어비스 검은사막  대만서  게임스타 어워드  우수상,Industry
 플라스틱으로 배 만든다고    롯데케미칼  호 사내벤처  에코마린  르포 ,Industry
 푸바오 알바생  흥행 성공 당근   설 연휴 집 지켜줄 사람 찾아요 ,Industry
메디톡스  뉴라덤  일본 최대 쇼핑몰  라쿠텐  론칭 ,Industry
  현대중공업   힘센엔진   만 천 대 생산 달성 기념행사,Industry
 점심브리핑       에어드랍 이후     소각 우려,Industry
  현대중공업   힘센엔진   만 천 대 생산 달성,Industry
한미약품그룹     와 통합  채무 해결에 시너지 확보 기대 ,Industry
두산에너빌리티  태국에  무탄소 발전기술 공급  추진,Industry
 그륩 협력업체 함께 안전보건 실천 다짐 ,Industry
강원도 산골짜기도  쿠세권    쿠팡  로켓배송 권역 확장,Industry
플링  하이틴 로맨스 웹드라마  소년을 위로해줘  최초 공개,Industry
 범죄도시    서울의 봄  흥행에  플러스엠  누적 관객  위,Industry
특허청  지식재산 기본교재  지식재산 첫걸음  발간,Industry
현대모비스  전동화 신바람 작년 해외수주   조  최대 ,Industry
 인터뷰  강원랜드 경쟁력 확보 드라이브 거는 최철규 대표 직무대행,Industry
이완규 법제처장  소상공인 위한 불합리한 규제개선 등 법제적 지원 ,Industry
 애플 효과  본   세미콘  사업 확장 속도,Industry
      전환사채 채무조정 합의  현금 유동성 재무 안정성 개선 ,Industry
이회성 무탄소연합 회장  재생에너지와 원전은 보완관계 ,Industry
  현대   독자 중형엔진  만    대 생산 신기록,Industry
고트만      년형 트라이탄 밀폐용기 출시,Industry
  현대중공업 개발 선박엔진  힘센엔진   만    대 생산 달성,Industry
         로 시작하는 국제 스팸 조심    설 연휴 주의 필요,Industry
정연숙 세종맘카페 대표 아너 소사이어티   호 가입,Industry
 공항멤버십 도입 추진  한국공항공사 야놀자  협력 ,Industry
 천억 규모 글로벌공급망 펀드공모에 운용사   곳 몰려,Industry
소상공인 저신용 직접대출 신청 일시  먹통   매번 반복 ,Industry
해진공  항만물류 유관  개 협회와  경쟁력 강화 업무 협약  체결,Industry
    설 앞두고 협력사 납품대금  조    억원 조기 지급,Industry
우수사원  명에 우리 사주  억원 지급한 명품 플랫폼,Industry
한경협  기부문화 활성화 위해 공익법인 규제 완화해야 ,Industry
  조    억원 미리 푼다  삼성 현대차     설 앞두고 납품대금 조기 지급,Industry
네이버  클로바  스킬에 채용 기능 추가 구인구직 편의 제고,Industry
 인천공항 경기 심야버스  개 노선 추가 ,Industry
삼성  설 앞두고 협력사 물품대금  조    억원 조기 지급,Industry
국토부  부산 거점  시리우스 항공 에 항공화물운송사업 면허 발급,Industry
강원랜드  복합리조트 경쟁력 강화 본격 드라이브,Industry
플랫폼법  결국  네카오 규제법  되나,Industry
  현대    힘센엔진   만    대 생산 달성    행정 중형엔진 ,Industry
    자립준비청년 매입임대주택    가구 청약 접수 시작,Industry
한국    정정윤     임명 새    에 윤명옥 전무,Industry
에쓰오일  바이오 순환 원료 기반 화학제품 생산 개시,Industry
두산에너빌리티  태국에 무탄소 발전기술 공급 추진,Industry
  현대중공업   힘센엔진   만    대 생산 신기록 달성,Industry
  엔솔  지난해 성과급 평균        전년 대비 반토막,Industry
 태국 무탄소 발전기술 도입 협력 나서 ,Industry
 실적에 규제에      우시 연달아 악재  삼바 반사이익 가능성 ,Industry
두산에너빌리티  태국전력청과 무탄소 발전기술 협력,Industry
삼성  설 맞아 협력사 물품대금    조 앞당겨 지급,Industry
금산군      년 산림소득분야 보조사업 신청 접수,Industry
현대   독자 개발  힘센엔진  누적  만    대 생산,Industry
    반도체 세정 장비 기술  중국 유출한 국내 업체 임직원  명 기소,Industry
소공연 법제처  소상공인 경영활동 저해 규정 개선 위해  맞손 ,Industry
두산에너빌리티  무탄소발전기술 태국공급 추진,Industry
 르포  오전 문의 전화만    건  저신용 소상공인 정책대출  쇄도 ,Industry
최저      신생아특례대출 첫날 폭주 사이트  시간 이상 대기,Industry
두산에너빌리티  태국에 무탄소 발전기술 공급 추진,Industry
 재생에너지만으론 탄소중립 불가 원전 등 활용해야 가능 ,Industry
주영창 과기혁신본부장     방문해    현황 파악,Industry
한미그룹     와 통합  미래성장     시너지 극대화 ,Industry
  프레시웨이      미래복지경영과 급식 서비스 협력 강화,Industry
차 판매 줄어도 바퀴는 달린다   타이어 질주,Industry
    설 앞두고 협력사 납품대금  조    억원 조기 지급,Industry
 설 연휴  집 지키면   만원  당근알바  명절 맞이 프로모션 진행,Industry
티웨이  인천 사가 노선 앵콜 특가 프로모션,Industry
 환경오염 대응 인체 스트레스  내장 비만 심혈관 건강에 영향 ,Industry
  바이오팜  세노바메이트  약발에 흑자 전환,Industry
더존비즈온의 클라우드       국내 최초 국제 벤치마크 등재,Industry
 게시판  한전     공정위 협약이행평가  우수  등급 획득,Industry
     서 악성  세포암 발병 위험 부상    큐로셀 앱클론 은 문제없나 ,Industry
발주    가   억 미만 고용장관  공공기관부터 안전관리 ,Industry
남선알미늄  한국    협신회  벤치마킹 행사로 본사 방문 ,Industry
  현대중공업  독자 기술  힘센엔진   만 천 대 생산 기록,Industry
 게시판  노동부   개 공공기관  중대재해 감축  공동선언문,Industry
동물병원 호텔에 반려동물 맡기고 연락두절 사기죄  동물법전 ,Industry
 게시판  중흥그룹  협력업체 공사대금  천   억원 조기 지급,Industry
 비곗덩어리  삼겹살  이번엔 식자재 할인마트에 나타났다,Industry
   코리아  다재다능 패밀리      뉴 디스커버리 스포츠  출시,Industry
한국타이어 후원 포뮬러         디리야         마무리,Industry
    일본 돈키호테 홍콩 파크앤샵에   상품 직수출,Industry
 스타셰프가 직접 요리  제주 드림타워  발렌타인데이 특선메뉴,Industry
손경식 회장  중처법 확대 시행  노동문제 타협 부족 때문 ,Industry
  그룹  설 앞두고 협력사 납품 대금  조    억 조기 지급,Industry
    설 맞이해 협력사 납품대금 조기지급  조     억원 규모,Industry
데브시스터즈  새    에 조길현 스튜디오킹덤 대표 내정,Industry
손경식 경총 회장  중대재해 예방에 초점 맞춰야  보완입법 절실 ,Industry
넥센타이어   디자인 철학 스토리  영상 공개 이벤트,Industry
이녹스첨단소재  청주에 공장 신설     억원 투자,Industry
고리원자력본부  지역경제 활성화 이벤트,Industry
한국수목원정원관리원  지역상생 농가육성  참가자 모집,Industry
  바이오팜   분기 흑자전환  수익성 입증 원년 삼을 것 ,Industry
  바이오팜     년    영업익    억원  흑자 전환  세노바메이트 효과,Industry
디블렌트        앤어워드   관왕 달성,Industry
새해부터 중동으로 사업 기회 찾는    의료기기,Industry
치매 환자에 희소식   비만약 으로 치료  임상결과 곧 나온다,Industry
즉석밥 냉동김밥 해외서 인기 쌀 가공식품 수출  사상 최대 ,Industry
