titles,category
세계 최초   폰  이 나라 서 대박  유통업체  전작보다  배 더 ,Industry
효성그룹  지난해 영업이익        엇갈린 중공업 화학,Industry
코오롱모빌리티그룹  출범 첫 해 영업이익    억원 매출    조원,Industry
  이노텍  성과급 최대      지급 전년      그쳐,Industry
 주총 관전 포인트  치열해진 오너  경영권  물밑경쟁 ,Industry
 라멘 원조국  접수한    라면  뭐길래 여행 핫플 돈키호테도 뚫었다,Industry
  조 기부왕 창업주  삼영산업  해고 직원 전원에 퇴직금   억지급,Industry
경총 회장의 공포 키우기   중대재해법 때문에 한국행 거부한 외국 기업 임원 있다 ,Industry
삼성 현대차     설맞이    조 납품대금 조기지급,Industry
삼성  보유재산        아시아   위,Industry
코오롱모빌리티그룹  출범 첫해 매출    조원 영업익    억원,Industry
도요타 또 성능 조작 드러나    개 차종 출하 중단,Industry
대기업  협력사 대금 조기지급 설 경기 활성화,Industry
  바이오팜  지난해  분기 적자 탈출 성공,Industry
린나이  취약계층에 가스레인지 지원,Industry
   펫푸드    넘어 북미 유럽으로 확장 ,Industry
올해 과수화상병  경계령  농진청  가지치기 때 궤양 제거 당부,Industry
삼성 현대차     협력사 납품 대금  조원 조기 지급,Industry
아카시아꿀과는 완전 달라요 국산 아까시꿀  제대로 알고 먹자,Industry
 관점  달에 간   인도  지구 저궤도 머문   민관 원팀으로 우주 관문 뚫어야,Industry
   패스 로고   가지 중 골라주세요  내일까지 이용자 설문조사,Industry
  엔솔  전기차 수요 성장 둔화에 성과급 반토막,Industry
부산 기반 신규 화물전용 항공사  시리우스항공  출범,Industry
지아이이노베이션  면역항암제 암 백신 병용임상 추진 ,Industry
 노동시장 낡은법  올해는 반드시 개선 ,Industry
  엔솔 노조   반토막 성과급 에 불만 폭발,Industry
첫 분기 흑자 달성한 발란 창사  년만,Industry
   사용자들  해외 로밍  곧 못 쓴다  월 미국부터 순차 종료,Industry
 바이오게시판  광동제약  노안 치료제 후보물질 도입 등,Industry
화학 업종 부진에도 효성그룹  중공업 선방에 실적 소폭 개선 종합 ,Industry
평택 삼성반도체 공장 앞에서 통근버스에 치인 근로자 숨져,Industry
제 이통사 선정  과열  주파수 경매  일차  입찰가     억까지,Industry
층간소음 해결할 기술 없는데  무조건 기준 맞춰라  황당 규제,Industry
정용진    톱모델 지지 하디드와  찰칵   억측 마시길 ,Industry
강원 수출 둔화에도 원주 의료기기  호조  올해 중동시장 공략,Industry
  토요타  품질경영  흔들    개 차종 출하 중단,Industry
소프트뱅크벤처스     로 새 출발     억원 규모 펀드 결성 깜짝 소식 전해,Industry
 중국인 입맛에 맞는 전기차 만들겠다  정의선 회장  결단 ,Industry
대웅제약 폐 희귀병 신약물질 유럽 희귀의약품 지정,Industry
현대차  중국 맞춤형  전기차 만든다,Industry
         현대차 월드랠리팀           첫 시합부터 우승,Industry
원료 값 부담에 지난해 하이트진로 영업익     ,Industry
 배터리 수요 둔화    엔솔  성과급          로 축소,Industry
 대전서     타고 왔는데 상품이 없대요  품절사태에 온라인 판매 추진  대체 뭐길래,Industry
한미약품그룹      통합 후 채무 조기상환 등 시너지 기대 ,Industry
실내골프장에 밀리더니 외국인들 놀라던    방  사라진다,Industry
 억울하면 승격하든가    치지직     저장기간  무제한   일 ,Industry
 속보  이태원특별법 재의 안건 내일 국무회의 상정,Industry
   반도체 보조금  표 안되는 삼성전자 후순위 ,Industry
대기업들 성과급 희비 삼성 모바일  연봉의      종합 ,Industry
 희비 교차  삼성전자 성과급 모바일  연봉         반도체   원 ,Industry
이번엔 노조리스크  삼성 경영  가시밭길 ,Industry
제 이통 경매  천   억원 돌파 마이모바일  과열돼 매우 걱정 ,Industry
냉혹한 성과급의 계절 실적 좋아도 나빠도  불만족 ,Industry
현대차 월드랠리팀     개막전 우승,Industry
카카오는 재매각 부인했지만 바람 잘 날 없는   ,Industry
제  이통사 선정 주파수 경매 입찰액   천   억으로  껑충 ,Industry
애플 덕에 삼성         웃나,Industry
포스코인터 첫 영업익   조 클럽 ,Industry
보령  고혈압 치료제  카나브  덕에 지난해 역대 최대 실적,Industry
효성티앤씨  작년    영업익    억  흑자전환,Industry
타다 대표에 강희수 전 요기요 플랫폼본부장,Industry
아이폰 인기에도  애플페이 결제율   대,Industry
삼성 모바일경험 사업부  성과급  연봉      받아,Industry
    신설 한국    내수 공략 속도,Industry
제 이통 경매     억 돌파   승자의 저주 우려도,Industry
삼성 현대차     상생   협력사에  조    억 조기 지급,Industry
보이스피싱 넘어 딥페이크 쓰나미 규제 사각지대,Industry
효성중공업  지난해 영업익     억 전년비     ,Industry
효성첨단소재  지난해 영업익     억 전년비       감소,Industry
금호석유화학  작년 영업익     억   전년        ,Industry
메디컬   씨어스테크놀로지  디지털헬스케어 연구     체결,Industry
설날 함께 즐겨야죠 삼성 현대차     협력사 대금  조    억 미리 푼다,Industry
코리그룹  프리미엄 액상분유  글로벌 마케팅으로 매출 견인할 것 ,Industry
 켈리 광고비 증가  하이트진로  지난해 영업익     억     ,Industry
     시리즈 인기에  코오롱모빌리티그룹  지난해 영업익    억,Industry
효성티앤씨  작년 영업익     억 전년      증가,Industry
효성  작년 영업익    억원 전년 대비       증가,Industry
  조 기부왕  설립한 삼영산업  전직원 퇴직금   일까지 지급 ,Industry
 한화에어로   조대 자주포 추가수주 임박 ,Industry
전 세계 김밥 열풍 불더니  쌀 가공식품 수출액 사상 최대,Industry
코오롱모빌리티  작년 매출    조원 영업이익    억원,Industry
카카오     매각설에  사실 아니다 ,Industry
보령  지난해 매출     억원  카나브 최대실적 견인해 ,Industry
셀트리온 바이오시밀러   품목허가 신청 완료,Industry
 다가오는 밸런타인데이  달콤한 디저트로 사랑 표현하세요 ,Industry
     바이오 기업과 거래금지    발목 잡힌 우시  기회 잡은 삼바,Industry
효성화학  지난해 영업손실     억 적자폭 개선,Industry
시몬스 침대가 선보인      스프링 매트리스,Industry
효성첨단소재 작년 영업익     억 전년       ,Industry
  알리 테무는 빼고 국내기업만 역차별 규제 논란,Industry
전기차 수요 부진에 리튬   분의  로 추락   배터리 업계 긴장감,Industry
유화경기 침체에 금호석화  지난해 영업익     억원       감소,Industry
현대모비스  해외수주   조원 돌파   전동화 전략 통했다 ,Industry
  현대   힘센엔진  누적생산  만    대 돌파,Industry
에쓰오일  국내 최초  바이오 원료  정유 공정 투입,Industry
삼성 한화 기아    로비자금  역대급  지출,Industry
 전기차 한파 에 완성차 수익 지각변동  배터리업계도 비상,Industry
  이노베이션 프로젠   백시젠  면역항암제 암백신 병용 치료 개발 추진,Industry
 국제무역 전문가   플랫폼법 겨냥  미국기업 차별 법안  지적,Industry
네이버  웹소설 플랫폼 왓패드    여 명 감원,Industry
전기료 할인  한전 독박  국회도 책임,Industry
 새내기주  포스뱅크 엘앤에프 희비 상장 첫날 성적표 보니,Industry
롯데에너지머티리얼즈  지난해 영업익    억   전년       ,Industry
컴투스홀딩스  소울 스트라이크   태국에서  위,Industry
카카오    엔터 매각설 사실 아냐  공식 부인,Industry
 코인베이스 주가 더 떨어진다      소송     하락 영향,Industry
  현대   힘센 엔진  누적  만    대,Industry
 설 경기 띄운다  삼성  협력사 대금  배 늘려,Industry
강원도 산골 폐광촌까지 쿠팡  로켓배송   곳 추가,Industry
 중대법 방치하면  최저임금 때처럼 고용급감 되풀이 ,Industry
저렴한 임대료에 바이오벤처   곳 몰려  수시로 협업 가능 ,Industry
   코퍼레이션     카메라가 침입자 조기탐지 ,Industry
 내부  외부   주류  비주류  포스코 회장 대진표에 쏠린 눈,Industry
카카오    엔터 매각설 사실 아냐  공식 부인,Industry
롯데정보통신  작년 영업익    억원 전년       신사업 순항,Industry
네이버웹툰  자회사 왓패드  올초 직원     해고,Industry
모스이민컨설팅   미국 투자이민 전문업체의 영주권 취득 노하우 공개 ,Industry
 다양성이     경쟁력 여성 연구위원 더 나와야죠 ,Industry
축구는  취퀸 이지    맘스터치  아시안컵  강 기원 최대     원 할인이벤트,Industry
구글  비트코인 현물     광고 허용 전망,Industry
루닛 유방암 검진    솔루션   서 판매 개시,Industry
협력사 물품 대금    조 조기 지급 설 경기 힘 보탠 삼성 현대차   ,Industry
달빛철도 등 재량성 예타 면제 남발 제도 무력화 우려,Industry
효성화학 작년 영업손실     억 적자 폭 개선,Industry
    된 선생님  경영도 학급운영과 비슷했죠 ,Industry
대상  지난해 영업익     억      바이오 부문 부진,Industry
 직원        업무 투입   배터리 장비에   년 앞서 ,Industry
국내 스타트업      플랫폼 경쟁촉진법  생태계에 부정적 ,Industry
대상  작년 영업이익  천   억원 소재시장 불황에     감소,Industry
스텔라   프로토콜     업데이트 연기 가능성  버그 발견 영향,Industry
 세대 스포츠 팬      경기 보며    로 실시간 피드백 ,Industry
네이버 북미 웹소설 플랫폼 왓패드  구조조정으로   여명 감축,Industry
 같은 회사도  층 울고  층 웃는다  대기업 성과급 속속 확정,Industry
한미약품      통합  창업주 철학 지키고 상속세 해결 ,Industry
도요타 또 왜이러나 이번엔  디젤 엔진  품질인증 부정행위,Industry
 사업주 처벌로 재해예방  동의못해 ,Industry
호실적 삼성전자 모바일 연봉    성과급 신바람,Industry
절박한 업계   협회 이름  석유  빼고 신사업 눈돌려,Industry
중국발 실적쇼크 석유화학사 올해도 비상,Industry
하이트진로 작년 영업이익     감소  재룟값 상승 부담  ,Industry
 연구중심 의료 혁신 이끄는 세계 리더로  강남세브란스병원  비전 선포,Industry
시세조종 논란 카카오    엔터 매각설 사실 아니다  공식 부인,Industry
이큐포올 수어티콘  글로벌 플랫폼 지피        누적 조회수  억뷰 돌파,Industry
한국에 단  명 있다는 자동차  금   귀    도 대체 못할 이 직업 아시나요   비즈    ,Industry
보령  작년     기반 호실적 달성  만성질환 항암제 강화 ,Industry
 비즈   신한카드    와 손잡고 차세대    연구  ,Industry
  천억원에 인수  네이버 왓패드  또 감원,Industry
      나노 유치에 돈 쏟아붓는   반도체  국가대항전 ,Industry
  이노텍  성과급 최대      지급 전년대비     그쳐,Industry
반도체    모바일       희비 엇갈린 삼성전자 성과급,Industry
 아웃렛보다 싸  창고 대방출 매장 뜬다,Industry
모니터 뚫을 듯한 거북목의 원인   기업건강지킴이  힐리언스코어센터에서 관리한다,Industry
삼성가  보유 재산 아시아   위  위는 인도  암바니 일가 ,Industry
춘천인형극제  몽골 국립인형극장과 협약 공연 교류 확대,Industry
금호석화  연간 영업익  분의  로  뚝   업황 침체에 마진 타격 ,Industry
구미시  반도체 연구기관  곳과 협약 특화단지 조성 탄력,Industry
하림       국내산 닭다리  불닭볶음면  밀키트 출시,Industry
반려묘 브랜드  캣츠빌리지         가낳지모 캣페어  참가,Industry
 켈리 판관비 증가  하이트진로  지난해 영업익    감소,Industry
아고다  아파트너 라운지 입점 입주민 가족여행 혜택 제공,Industry
시멘트  탄소중립 기술혁신 고도화 나선다,Industry
 인천공항 남양주 용인  경기 심야버스 운행 확대 일  회 운행,Industry
부산 상공계 정계  에어부산 분리매각 추진협  구성,Industry
직장인 커뮤니티서  직원 구해요    다양해지는 채용 방식,Industry
기업공시  월   일 ,Industry
찰스슈왑      현물     출시 가능성,Industry
카카오    엔터 지분 매각설에  사실 아냐 ,Industry
카카오    엔터 매각설 사실 아냐  공시,Industry
한국조폐공사  사랑의 떡국 떡 썰기 행사 실시,Industry
한국조폐공사  사랑의 떡국 떡 썰기 행사 실시,Industry
기후동행카드 직접 체험한 오세훈  이르면  월 신용카드 충전 ,Industry
비전   전문기업 인텔리빅스  우수기업연구소 선정,Industry
국내 게임사 타이페이 게임쇼 참가 펄어비스는 우수상 수상,Industry
광동제약   서 개발한 노안치료제 후보물질 도입,Industry
 영농기술        조 수수 기장 참깨 땅콩 신품종  종 신청하세요,Industry
팔레오  설날 건강 선물  특별 프로모션  실시,Industry
오사카 도쿄 등 가성비로 모두투어  일본여행 특가 모음  ,Industry
김포 김해공항서 야놀자 쿠폰 받는다,Industry
조달청 신임 차장에 백승보 서울지방조달청장 임명,Industry
에어부산 분리매각 범시민 추진협의회 출범    만명 서명운동,Industry
박수기 시의원  기아차 광주공장 이전 논의 시작해야 ,Industry
내달  노사정 대화  속도 역대 위원장들  진영논리 안돼  종합 ,Industry
 이권호 변호사 법률칼럼  기업회생   ,Industry
영업익       감소한 금호석화   증설에 승부수 종합 ,Industry
플랫폼법 정부안 내달 발표 전망 규제 대상 사업자 선정 촉각,Industry
          컴캐스트와 어깨 나란히 한 사연,Industry
    컨트롤타워  본격 가동나선 신동빈 롯데  어떤 사업 적용할까 ,Industry
애플  임윤찬 손잡고  클래식  시장 두드린 까닭,Industry
대상  지난해 영업익      억원   라이신 불황에     ,Industry
스타트업 대표를 위한 스타트업   마음 아픈    들에게,Industry
 초심력  저자  엠브로컴퍼니 임형재 대표와 함께하는 북 콘서트 개최,Industry
롯데에너지머티리얼즈  작년 영업익    억 전년대비      ,Industry
  엔솔  호실적에도 성과급  반토막  전기차 수요 둔화 영향,Industry
  이노텍  최대      성과급 실적 악화에  칼바람 ,Industry
 노조원  만    명  삼성 초기업노조  이번 주 닻 올린다  노사관계 중대 변화,Industry
넷마블      화투  등 설날 기념 특별 상품 출시,Industry
롯데에너지머티리얼즈  지난해 영업익    억 전년      감소,Industry
스타필드 수원서 느끼는  스웨덴 럭셔리   볼보  서수원 전시장 오픈,Industry
 세토끼  잡은    메타     공익법인 취득 의결권 규제 없애야 ,Industry
공익법인 족쇄에 투자도 승계도 막혔다,Industry
카카오    엔터 매각설 사실 아니다  공식 부인,Industry
테슬라  비트코인 이른 매각으로  억 달러 놓쳤다,Industry
  엔솔  전기차 수요 성장 둔화에 성과급           종합 ,Industry
롯데에너지머티리얼즈  최대 매출 올렸지만 영업이익     감소,Industry
롯데에너지머티리얼즈  지난해 영업이익    억원     감소,Industry
  녹십자웰빙  유영제약과   필러 수출 업무협약,Industry
 법정관리  대유플러스  매각주간사 선정하고 매각 추진,Industry
롯데에너지머티리얼즈  지난해    영업익   억원  전년          ,Industry
 중대재해법  발등 불 떨어진   만여 사업장   정부  지원대책 추진,Industry
롯데에너지머티리얼즈  지난해 영업익    억 전년      ,Industry
두메산골도  로켓배송  쿠팡   쿠세권  확장에 공들이는 이유,Industry
사고 터질 때까지 발만 동동 문턱 높은  강제 입원 ,Industry
롯데에너지머티리얼즈  지난해 영업익    억 전년비     ,Industry
 게임 좋아하면 누구나  넷마블  대학생 서포터즈  마블챌린저    기 모집,Industry
 기분 좋게 떠난 해외여행인데  진료비 폭탄 맞았다 이러다가 ,Industry
한국공항공사  야놀자 와 공항멤버십 도입을 위한 시범서비스 실시,Industry
  이노텍 성과급 지난해 절반  뚝  카메라사업부     ,Industry
 법  주택임대차 갱신 청구  법인의 실거주로 거절 가능할까,Industry
 표권향의 궁금증제로 우리 아파트의 엘리베이터     내 돈 나가는 거 아냐 ,Industry
롯데에너지머티리얼즈  지난해 영업익    억 전년        ,Industry
 이게 얼마만이냐  너도나도 흑자       콩고물 에 더욱 치열해진     순위 경쟁,Industry
새만금개발청 한국기술사회  새만금사업구역 안전문화 정착 및 기술협력을 위한 업무협약  체결,Industry
멍냥마켓  강아지 고양이용 습 건식 사료  플래티넘  국내 론칭,Industry
롯데머티리얼즈  역대 최대 매출에도 영업익은     감소,Industry
수입 철강 반덤핑 제소 검토에 후공정사  독점만 키워            ,Industry
길어지는 업황 둔화 금호석유화학  지난해 영업이익       ,Industry
신규 화물전용항공사 면허 발급  가덕도 신공항 거점 삼겠다 ,Industry
애플페이  찻잔속 돌풍    이용률      그쳐,Industry
삼성전자 성과급 희비 모바일은  연봉      반도체는 빈 봉투,Industry
어깨 수술 후 집에서  가상 재활   병원 방문 버금가  깜짝 효과,Industry
현대차그룹  설 앞두고 협력사에  조 원 납품 대금 앞당겨 지급,Industry
어촌어항공단  어촌체험휴양마을 사업 추진 방향 설명회,Industry
비손메디칼                   참가   듀얼악센토와 엘라덤 선보인다,Industry
 신용점수 낮출래요  저신용 대출 위해 고의 연체하는 사장님들,Industry
석화 혹한기 속 선방한 금호석화  올해 버틸 무기는 ,Industry
 건강뿐 아니라 실속 환경도 챙긴다  동원  설 선물세트    여종 선봬,Industry
현대차 깔보더니    테슬라 폴스타    전기차 둔화에  울상 ,Industry
한국해양진흥공사  항만물류 유관  개 협회와 항만 물류 경쟁력 강화를 위한 업무 협약  체결,Industry
포스코퓨처엠  환경부 차관 만나  인프라 확충 등 정부 지원 필요 ,Industry
전기차 전용 타이어 시장의 개척자  한국타이어  아이온      ,Industry
한국직업능력진흥원  마케팅 관련 자격증 온라인 강의 무료 진행,Industry
사내 근로자대표 선출 시 유의해야 할 사항은 ,Industry
커지는  부산 미스터리       감염 야생멧돼지 무더기 발견,Industry
애플뮤직  클래식 음악으로 한국공략  세계최대 규모 ,Industry
유튜브 돌연 중단했던  재벌  세  함연지  경영수업   이 곳 에 참석했다,Industry
화물 전용 항공사  시리우스 항공  면허 발급 이르면  월부터 운항,Industry
오는  월 김천시에서 경북 최초 전기버스 완성차 생산 개시,Industry
리튬플러스  무수 수산화리튬 생산 성공 배터리 소재 수출 박차,Industry
중부고속도로 청주강서 하이패스 나들목   일 개통,Industry
롯데에너지머터리얼즈 작년 영업익    억     감소,Industry
부산시  지역 주택 건설 공사 물량 확대 추진,Industry
금호석화  작년 영업익     억          올봄도 어렵다  종합 ,Industry
고용노동부 공공기관 안전보건리더회의,Industry
발언하는 이정식 장관,Industry
인천공항 수하물 처리시설 방문한 이정식 장관,Industry
발언하는 이정식 장관,Industry
인천공항 수하물 처리시설 방문한 이정식 장관,Industry
초코파이 비비고  대박  식품기업  바이오에 진출한 이유,Industry
하이트진로 이슬톡톡 오비맥주 필굿 편의점가    원씩 내린다,Industry
캠코  부산 취약계층 위해  억원 기부,Industry
 조금이라도 더 맛있는 거 먹길    서울시   월부터 아동급식카드  천원으로 인상,Industry
금호석유화학  지난해 영업익        올해 점진적 회복 전망,Industry
인천공항 수하물 처리시설 둘러보는 이정식 장관,Industry
광동제약  홍콩제약사 노안 치료제 후보물질  브리모콜  도입,Industry
인천공항 수하물 처리시설 찾은 이정식 장관,Industry
인천공항공사   월  일부터 인천공항 경기도 구간 심야 공항버스 운행 확대,Industry
이정식 장관  인천공항 수하물 처리시설 현장 점검,Industry
올해 경남 제조업 외국인 인력     늘어난다  일손 부족 숨통 ,Industry
삼성 현대차     설 앞두고 협력사에 대금    조 풀었다 종합 ,Industry
화일약품  행정처분  영업 상장 유지 문제 없어 ,Industry
 산업계 맏형  삼성     설 앞두고 대금 조기 지급 실질적 지원 다수,Industry
바이오던스   하이드로 세라놀 리얼 딥 마스크  출시,Industry
저신용 소상공인 대출 첫날 신청자 쏟아져  일시 먹통 ,Industry
이정식 장관  중대재해 감축을 위해 ,Industry
이정식 장관  공공기관 안전보건리더회의,Industry
공공기관 안전보건리더회의 주재하는 이정식 장관,Industry
고용부 공공기관 안전보건리더회의,Industry
고용노동부 공공기관 안전보건리더회의,Industry
 국대 베스트   예측  축구팬 로열티 프로그램 백호일레븐 출시,Industry
데이터메이커   년 연속     바우처 지원사업  공급기업 선정,Industry
  벡셀  전기차 부품 공급계약 체결  현대트랜시스에   억원 규모,Industry
라온반도체  고성능     모듈               출시 첨단 가전제품 탑재,Industry
 인간의 도덕성은 타고나는 것일까   서평 ,Industry
인지이솔루션  도로 살수차 및 먼지청소차용 배터리 업그레이드,Industry
 장 건강 면역력 돕는 사료  퓨리나  프로플랜 독  체험단 모집,Industry
저탄소 친환경 제품 만든다 에쓰오일  정유사 최초 바이오 원료 공정 투입,Industry
크린버텍  신제품 새로운 형태의 비정형 모양매트 제품 개발,Industry
현대모비스  현대차 기아 제외 해외수주   조  사상 최대 ,Industry
최대주주 바뀐 바이오 인수회사의 오너가 경영 직접 참여 예고,Industry
해진공  항만 물류 경쟁력 강화   대 관련 협회 맞손,Industry
에이아이썸  광고 서비스  에디    태국 시장에 론칭,Industry
법무법인 유한  대륜  곽민섭 전 부장판사 영입  기업자문 특화 ,Industry
한수정  농가 육성 프로그램  기 참가자 내달   일까지 공모,Industry
삼성 반도체   예상대로  올해 성과급    모바일은 연봉    ,Industry
       로칼  다음커뮤니케이션 쏘카 전문경영인 이재용    로 영입,Industry
삼성    설 연휴 앞두고 협력사 물품 대금 앞당겨 준다,Industry
에쓰오일의 친환경 실험 폐식용유로 항공유 나프타 만든다,Industry
더존 클라우드 서비스  국제 레퍼런스로 활용된다,Industry
삼성전자  연말 성과급 희비  반도체      모바일      ,Industry
롯데에너지머티  지난해 영업익    억  전년      ,Industry
해양진흥공사   대 항만물류 협회와 스마트항만  맞손 ,Industry
지놈인사이트  전장유전체 임상진단 분야서 미국 병리학회 인증 획득,Industry
    코리아      드라마  재벌 형사 에 주요 모델 협찬,Industry
이주 열기 시들해지자 곳곳 빈집 제주도 전수조사,Industry
버려졌던 인천 송림지하보도   시민휴식공간 으로 재탄생,Industry
중부발전  봉화 양수발전소 추진사무소 열어,Industry
엇갈린 삼성전자 성과급  연봉      모바일   빈 봉투  반도체,Industry
서울아산병원 진료비가 동네의원보다 싸다고   수가역전 해소돼야 ,Industry
반도체    모바일     삼성전자 연말 성과급 확정,Industry
중대재해법 본격 시행      신항 배후단지 안전교육 철저히 ,Industry
 맞춤형 로봇 슈트  휴로틱스   연구개발유형  벤처기업 인증 획득,Industry
 특별성과급 달라  현대차 기아 노조 요구 계열사가 긴장하는 이유,Industry
 월 분양 비수기 무색 전국  만    가구 분양,Industry
 년만에 사라지는   페이 오는  월 서비스 종료,Industry
농협  미래 농업 이끌 청년농부사관학교 교육생 모집한다,Industry
한화오션  친환경 해운업 진출 검토  시기 방식 미정 ,Industry
전기차 수요 성장 둔화에   엔솔  성과급 전년 대비 반토막,Industry
