titles,category
비수기 맞아  내달 전국서    만 가구 공급,Real_estate
잡음 많은 사전청약  분양가 고정  법안까지 나왔다,Real_estate
 실거주 의무  년 유예 에 하반기 강남권 전셋값 출렁이나,Real_estate
 월 집들이  만    가구,Real_estate
포스코이앤씨  부산 촉진   구역 수주,Real_estate
나만 모르는 아파트 옵션비의 비밀  전수조사 해봤습니다 | 흥청망청,Real_estate
인천 vs 김포  진정 이 노선이 최선인가  | 총총견문록,Real_estate
GTX A B C D E F 교통대책 긴급분석  | 집코노미 타임즈,Real_estate
이자부담 줄여주는 신생아특례대출 뽀개기 | 흥청망청,Real_estate
돈 버는 안목이 있는 사람에겐 지하  층으로 보입니다 | 총총견문록,Real_estate
 대한주택건설협회  소방취약계층 소화기 지원행사 열어 ,Real_estate
  건설자재 수급 여건과 정책 개선방안  세미나 개최 ,Real_estate
 확 바뀌는 자양동 뚝섬 인근    층 한강뷰 재개발 된다 ,Real_estate
 서울시    세 이상  어르신 안심주택  도입  주변 시세      ,Real_estate
 호반건설   건설현장 안전역량평가  국토부장관상 수상 ,Real_estate
  병원 보건소      이내  서울시  어르신 안심주택 첫 도입 ,Real_estate
 반도건설  미국 LA  차 주택사업  더 보라       착공 ,Real_estate
 대우건설  지난해 매출   조    억원 전년보다       증가 ,Real_estate
 인천 검단구  민 관합작  여의도  배 면적 개발 ,Real_estate
  괜히 팔았나    억 여의도 아파트   개월 만에 가격이 ,Real_estate
 회원전용 용적률        여의도 최고 입지인데   년째 재건축 못하는 이유  ,Real_estate
 회원전용GTX 말잔치의 맹점  가지  집코노미 타임즈  ,Real_estate
 회원전용 마래푸 뛰어넘을  마자힐  온다  국민평형 분양가   억 시대 열까 ,Real_estate
 회원전용 밤마다 윗집 아저씨  발망치  고통      년부터 층간소음 사라질까 ,Real_estate
 회원전용  일부터 시행 신생아특례대출 총정리  흥청망청  ,Real_estate
 건물 신축 시 시공사 선정은 어떻게 해야 할까요  ,Real_estate
 부동산PF 부실이 심각하다는데   올해 부동산 투자 어떻게 할까요  ,Real_estate
 강남구 더블역세권 신축 빌딩 등  건 ,Real_estate
 양평군 남한강변 스타벅스DT 건물 등  건 ,Real_estate
한번 되면   년 거뜬  금융지주 회장  절반 넘게 새얼굴,Finance
신한카드  LG와 손잡고 AI 어시스턴트 개발,Finance
태영 PF 현장실사  안진이 맡는다,Finance
농협 하나 이어 KB도 ELS 판매 중단 홍콩ELS 손실 여파,Finance
농협은행  NH농협카드 NH페이 앱 통합한다,Finance
수출입   상생금융      억원    억원   억원  발표,Finance
  대 중고차 선호도  위  아반떼  현기차  톱   싹쓸이,Finance
신한카드  고객과 함께 사전답사 여행  호주 원정대  이벤트,Finance
농협은행 리스크관리부문  사랑의 떡국세트 나눔,Finance
고병일 광주은행장  고향사랑기부제 동참 캠페인,Finance
빗썸  대학생 서포터즈  썸즈업   기 발대식 진행,Finance
국민은행  전통시장서   억원 식료품 구매해 소외계층 전달,Finance
 스파크 차주     만원 벌었다    보험료 비교 놀라운 결과  조미현의 Fin코노미 ,Finance
제 금융권 중도상환수수료 인하된다 불공정관행 개선,Finance
제 금융권 대출 중도상환수수료 줄인다 실제 비용만 반영,Finance
부동산PF 부실에도 증권사  성과급 잔치  금감원  위법 관행 제동 ,Finance
거리두기 끝났는데도 배달서비스 매출      늘었다,Finance
현대캐피탈    억 달러 규모 글로벌본드 발행 성공,Finance
작년   월 수출금액       반도체 회복에 석 달 연속 상승,Finance
  일부터 전세대출도 대환대출 서비스 시작,Finance
증권사 부동산 PF 성과보수 일시지급  위규 사례  다수 적발,Finance
내달부터 자본시장 불공정거래 신고포상금 한도   억원으로 상향,Finance
농협에 이어 하나은행도 ELS 판매 전면중단 국민   검토 중 ,Finance
하나은행  외화적금 가입하면  달러 입금해드려요 ,Finance
KB금융  블라인드 펀드에 ESG 투자 기준 적용 ,Finance
안산도시공사  내달  일 OK금융그룹 홈경기 무료관람 이벤트,Finance
KB금융  ESG 경영 실천 기업에 펀드 투자 확대,Finance
삼성생명  매일     보 걸으면  CU 상품권  준다,Finance
한투운용  러시아 ETF 상장폐지 재연기 연말 이후 효력 발생,Finance
수출입은행도 민생금융지원 동참 중소기업에  천   억원,Finance
은행권  청년도약계좌 중도해지 이율 상향 등 혜택 ,Finance
현대해상  업계 최초  자녀 이상  보험    추가 할인,Finance
카카오뱅크  아이 일기도 대신 작성  오늘의 mini 일기  출시,Finance
 어쩐지 김혜수 안 보이더라  발란   중대 결단  통했다,Finance
동생 구속되자 형이 나섰다  최소 수천억  많게는  조 손해 ,Finance
  년 다니고 특진도 했는데   충주시 홍보맨 월급에 갑론을박,Finance
 한국에선 답 없다  강남 부자들  뭉칫돈  싸들고 간 곳이,Finance
농구단까지 샀던 회사의 기막힌 몰락 자본시장서 퇴출당했다,Finance
  과학기술의 힘 전력 끊긴 달 탐사선   일 뒤 살아났다,Finance
 스파크 차주     만원 벌었다    보험료 비교 놀라운 결과,Finance
  조도 적다  쩐의 전쟁 치고 나간 TSMC에 삼성  맞불 ,Finance
젊은층  블랙홀  된 서울      들어오고   대 이상 나갔다,Finance
타율론 강조한 최상목 기재부 사무관들  열광 ,Finance
 이 가격 실화   관광객들 깜짝 일본여행  필수코스 의 비밀,Finance
만화책 출판서 종합 콘텐츠 로  슬램덩크  대원씨아이의 변신,Finance
초고속 반도체 검사용 초미세 기판  처음 국산화에 성공한 TSE,Finance
최태원 손에 든 제안서   년 전  이병철 잡스  회동의 데자뷔,Finance
피습 직전 배현진 애태웠던 건  서울 선거 이대론 안돼 ,Finance
 제 지대 빅텐트  남은 퍼즐 이준석 이낙연  결합 가능할까,Finance
테슬라 사옥도  이 회사 가 관리 화장실 빈칸까지 알려준다,Finance
HD현대일렉트릭 수주공시      kV 및    kV 고압차단기 등    억원  매출액대비         ,Securities
 깜짝 실적  발표한 금호타이어    주 최고가 경신,Securities
    년  월   일 화  SPDR S P     ETF Trust SPY 가 사고 판 종목은 ,Securities
비나텍    수소전지 기업과 MEA 공급계약 체결 ,Securities
 인적분할시 자사주 신주배정 금지   보유사유 계획도 공시 ,Securities
금호타이어  작년 영업익     억 전년비         주목 e공시 ,Securities
금호타이어 작년 영업이익  천   억원 전년 대비  천       ,Securities
 동아지질    주 신고가 경신  천주교 부산교구 금정구 부곡동     종교시설 증축공사      억원  매출액대비        ,Securities
현대제철  작년 영업익     억 전년비         주목 e공시 ,Securities
타임폴리오  글로벌AI액티브ETF  반년 새 수익률     ,Securities
당일 증권사 관심 종목   SK바이오팜   금호석유 등,Securities
 BNK금융지주    주 신고가 경신  매력적인 밸류에이션   흥국증권  BUY,Securities
 마켓칼럼  소부장펀드 청산을 기념하며,Securities
 마켓PRO   양자보안은 신시장 상반기 중 제품화해 하반기엔 매출 본격화 ,Securities
비트코인   개월 연속 상승세  GBTC 유출 둔화 긍정적 ,Securities
자이에스앤디  작년 영업익     억 전년비          주목 e공시 ,Securities
 최다액출자자 변경  부적격   씨씨에스   하한가 ,Securities
비츠로시스 수주공시   연천군 공공하폐수처리시설 TMS 유지관리     억원  매출액대비          ,Securities
금융당국  상장법인 인적분할 시 자사주 신주배정 금지  추진,Securities
 마켓PRO   역대 최고가  엔비디아  더 오를 수 있을까 투자 고수들 판단은,Securities
 어쩐지 김혜수 안 보이더라  발란   중대 결단  통했다,Securities
동생 구속되자 형이 나섰다  최소 수천억  많게는  조 손해 ,Securities
  년 다니고 특진도 했는데   충주시 홍보맨 월급에 갑론을박,Securities
 한국에선 답 없다  강남 부자들  뭉칫돈  싸들고 간 곳이,Securities
농구단까지 샀던 회사의 기막힌 몰락 자본시장서 퇴출당했다,Securities
  과학기술의 힘 전력 끊긴 달 탐사선   일 뒤 살아났다,Securities
 스파크 차주     만원 벌었다    보험료 비교 놀라운 결과,Securities
  조도 적다  쩐의 전쟁 치고 나간 TSMC에 삼성  맞불 ,Securities
젊은층  블랙홀  된 서울      들어오고   대 이상 나갔다,Securities
타율론 강조한 최상목 기재부 사무관들  열광 ,Securities
 이 가격 실화   관광객들 깜짝 일본여행  필수코스 의 비밀,Securities
만화책 출판서 종합 콘텐츠 로  슬램덩크  대원씨아이의 변신,Securities
초고속 반도체 검사용 초미세 기판  처음 국산화에 성공한 TSE,Securities
최태원 손에 든 제안서   년 전  이병철 잡스  회동의 데자뷔,Securities
피습 직전 배현진 애태웠던 건  서울 선거 이대론 안돼 ,Securities
 제 지대 빅텐트  남은 퍼즐 이준석 이낙연  결합 가능할까,Securities
테슬라 사옥도  이 회사 가 관리 화장실 빈칸까지 알려준다,Securities
 세계  위 전기차시장 포기 못해     액셀  밟는 정의선,Industry
포스코인터 첫 영업익  조 클럽 삼성물산 SK네트웍스도 질주,Industry
차량용 OLED 덕에 삼성 LG 웃나,Industry
대영채비   채비 CHAEVI  로 사명 변경 글로벌 전기차 충전 시장 선도 사업자 도약,Industry
수자원공사  대전시와 지역특화 협력사업 업무협약,Industry
새해에도 이어지는 예산시장 인기 한 달 만에   만명 방문,Industry
     서울패션위크  복합문화공간    카페  홍대카페 에서 패션쇼,Industry
건설주택포럼 회장에 권준명 무궁화신탁 대표,Industry
  서 순식간에 완판  반응 뜨거웠던  그 차  한국에 온다,Industry
스텔란티스코리아  방실 대표이사 사장 선임  첫 여성 지사장 ,Industry
자이에스앤디 작년 영업익  천   억원 전년 대비       ,Industry
쇄빙연구선  아라온호   남극 바다서 응급환자 지원,Industry
충북 제천에서 국내 최대 금맥 발견 금맥 폭   m 연장     m,Industry
 유튜브도 못봐  애플 야심작  뜻밖의 흥행 에도 불안,Industry
노후아파트 전기차 충전기 늘리고 미래차 전환기업 지원 강화,Industry
경남 지난해 농식품 수출   억 천만달러 사상 최대,Industry
캠코 부산연합기술지주  기술 우수기업 정상화 지원 협력,Industry
스텔란티스코리아  신임 사장에 방실 전 르노코리아 상무 선임,Industry
현대제철 지난해 영업이익  천  억원 전년 대비     ,Industry
  조도 적다  쩐의 전쟁 치고 나간 TSMC에 삼성  맞불   황정수의 반도체 이슈 짚어보기 ,Industry
 인사  한국농수산식품유통공사,Industry
수출 온라인지원협회  인도네시아 현지 법인과 중소기업 수출 협력체제 구축,Industry
램리서치 한국법인 총괄대표에 박준홍 부사장,Industry
 인사  한국해양교통안전공단,Industry
유인촌 장관  방한 관광시장 고부가화 중요 서울쏠림 완화해야  종합 ,Industry
LS머트리얼즈  전기차용 알루미늄 부품 사업 본격 추진,Industry
현대차 없이도   조 잭팟 해외서  이 기업  대박 났다는데,Industry
아이디스  TTA 인증 IP카메라 판매 증가세,Industry
방산기업 휴니드  영국 군 통신사 손 잡고 글로벌 시장 공략,Industry
 과일 잔류농약 원정 검사 그만  영동군 친환경 종합분석실 구축,Industry
 이런 게 국뽕이지   가전은 역시 LG  전세계서 통했다,Industry
볼보트럭  FH 에어로 공개   연료    절감 효과 ,Industry
친환경 해양 모빌리티 솔루션 기업 빈센  시리즈C    억 투자 유치,Industry
 어쩐지 김혜수 안 보이더라  발란   중대 결단  통했다,Industry
동생 구속되자 형이 나섰다  최소 수천억  많게는  조 손해 ,Industry
  년 다니고 특진도 했는데   충주시 홍보맨 월급에 갑론을박,Industry
 한국에선 답 없다  강남 부자들  뭉칫돈  싸들고 간 곳이,Industry
농구단까지 샀던 회사의 기막힌 몰락 자본시장서 퇴출당했다,Industry
  과학기술의 힘 전력 끊긴 달 탐사선   일 뒤 살아났다,Industry
 스파크 차주     만원 벌었다    보험료 비교 놀라운 결과,Industry
  조도 적다  쩐의 전쟁 치고 나간 TSMC에 삼성  맞불 ,Industry
젊은층  블랙홀  된 서울      들어오고   대 이상 나갔다,Industry
타율론 강조한 최상목 기재부 사무관들  열광 ,Industry
 이 가격 실화   관광객들 깜짝 일본여행  필수코스 의 비밀,Industry
만화책 출판서 종합 콘텐츠 로  슬램덩크  대원씨아이의 변신,Industry
초고속 반도체 검사용 초미세 기판  처음 국산화에 성공한 TSE,Industry
최태원 손에 든 제안서   년 전  이병철 잡스  회동의 데자뷔,Industry
피습 직전 배현진 애태웠던 건  서울 선거 이대론 안돼 ,Industry
 제 지대 빅텐트  남은 퍼즐 이준석 이낙연  결합 가능할까,Industry
테슬라 사옥도  이 회사 가 관리 화장실 빈칸까지 알려준다,Industry
